id,keyword,location,cleaned_text
10275,war%20zone,,peopl bake without turn kitchen war zone egg flour
4509,emergency,USA,deal    37592 temporari fake tooth teeth replac kit emerg dental oral care cosme    
5354,fire,"Yuba City, CA",heart bigger obstacl  front euro dontexpectnoth juli fire  euro
8382,ruin,Florida Forever,rt ruin  connormidd  s day   
6031,hazardous,"New Delhi, Delhi",foodscar offers2go nestleindia slip loss magginoodl ban unsaf hazard humanconsumpt
9836,trauma,Gumptown, arobotlegion it  can t tell oppress group peopl react trauma  would stupid ignorant 
2339,collapse,,spot fixing match fix   anyone    or ha pak sl wi rsa bd say this  sham say team collaps
1443,body%20bagging,Texas,g     bodi bag lyrically  
7548,outbreak,,famili sue legionnaires  40 famili affect fatal outbreak legionnaires  disea    
10829,wrecked,#NewcastleuponTyne #UK, widda16     he  gone  relax  thought wife wreck cake wa goner mind lol whoop
4085,displaced,Magnolia,much would cost fat displaced  ask friend 
5664,floods,Australia,india 119000 peopl taken shelter 966 relief camp govern ha set floods    
7614,pandemonium,,world class tgirl ass 02   scene 4   pandemonium 
1959,burning%20buildings,"Nelspruit, South Africa",striker phalaborwa strike chines take jobs  striker burn build attack car 2    
6103,hellfire,, hellfire ev  jackperu1 thi one     
493,armageddon,#FLIGHTCITY UK  ,  offici vid   thereal  gt  gt  gt    gt  gt  gt   trubgm  gt  gt  gt  armageddon comin soon  
9251,sunk,,descend sunk howev may shadow land beyond crest strike cobra land harshli upon hi back  torch
1786,buildings%20on%20fire,,smoke detector requir buildings  offic build shevlin hixon drive wa fire  we    
3262,demolish,,enugu state govern appear set recov portion enugu intern confer ce     badotweet
1683,bridge%20collapse,Wiltshire,fuck go trent bridge    remind england  collaps caribbean back 90s   
73,ablaze,"Sheffield Township, Ohio",deputies  man shot befor brighton home set ablaz 
9576,thunder,"New York, USA",waldo thunder 12u cooperstown dream park 2015 dedic joestrong gokitgo 
3970,devastation,"Victoria, British Columbia", pam palmat agre  perrybellegard get  amp  vote  look devast  pmharper caus firstnat idlenomor cndpoli yyj
9425,survivors,"WV, love the blue and gold", arovolturi3000 surviv becaus magic  search wood survivor outsid london
5753,forest%20fires,,reddit   lightn spark new fire bois nation forest  r stormcom
10824,wrecked,"Denton, Texas",awesom time gettin wreck bowl last night  
5185,fatalities,"WestEnd, Puritan Ave ", dwilliams313  rt  ieansquad  don   t know fatal mortal kombat 
3142,debris,Hong Kong,malaysia confirm reunion island debri mh370   scmp new 
2761,curfew,,reason im listen curfew overtim stuck kodak
9540,terrorist,,three isra soldier wound west bank terrorist attack via  r worldnew 
7171,mudslide,,rt rabidmonkeys1  ah  uniqu mudslid cake   gbbo 
631,arsonist,ss,  doofus   diamorfiend im jokin still cant moves  
6394,hurricane,NAWF SIDE POKING OUT , hurricane dam         
7840,quarantine,"San Diego, CA",love chicago much game pink eye  sit design quarantin dark 
2119,catastrophe,"los angeles, ca",stylist who d silent say  there  cool show amazon prime call catastrophe    
10724,wreck,"Innsmouth, Mass.",stage locomot wreck could possibl go wrong  
2289,cliff%20fall,Sydney Australia,new updat huge cliff landslid road china   watch moment cliff collaps huge chunk rock fall    
3472,derailed,,it  free name new  doc  newidea  get back write w out derail think title  w twitter 
2457,collided,,first tweet collid selfie  pretti  sweet  ask me     
1933,burning%20buildings,Santiago Bernabeau,man run burn build live scare hit girl  get it 
2544,collision,"Sacramento, CA",traffic collis   injury  i5 i5 43rd ave offramp south sac 
9718,tragedy,,rli tragedi mp  live recount horror     when saw coach train plung water call     
10774,wreckage,,wreckag  conclus confirmed  mh370  malaysia pm    
6511,injuries,"Sutton, London UK", fkhanag look shad forsyth ha done 1 year mani injuri befor inevit injuri like
6775,lightning,,world war ii book lightn joe autobiographi gener j  lawton collin  
481,armageddon,"Castaic, CA",armageddon avert el patron ultimalucha
5776,forest%20fires,Based in CA - Serve Nationwide,properti loss northern california wildfir nearli doubl  via  yahoonew
2241,chemical%20emergency,"Moscow, Russia",day 2  liquid emerg chemic object  usar2015 usar15 ruor             
6255,hijacking,EastCarolina,hot  funtenna  hijack comput send data sound wave  black hat 2015   prebreak best
3465,derailed,The Desert of the Real, trustymclusti passeng derail train  morn commut fcked  go home 
9401,survivors,Port Williams NS,patient report outcom long term survivor metastat colorect cancer   british journal surgeri 
4723,evacuate,Brisbane,fire crew evacu passeng gold coast tram trap powerlin fell across carriage  tennew 5pm 
7366,obliterate,United Kingdom,wwe 2k15  univers mode   part 149   obliterate     via  youtub
6712,lava,??9?,wait chocol lava cake get       
1021,blazing,New York,morgan silver dollar 1921 p ch gem bu pl blaze ms       satin rare proof like    full re     
7360,obliterate,Miami via Lima,gop debat tonight jon stewart next week obliter    jonvoyag
893,bioterrorism,, o magazin satan  daughter shadow warrior 50ft women aka transgend mode ps nyc fold extra extra center bioterror
7197,natural%20disaster,Birmingham and the Marches, doylech they r refugees   peopl forc leav countri order escap war persecut natur disaster 
2198,catastrophic,Planet Earth,learn legaci catastroph erupt   new yorker 
1864,burned,,burn today oven    wa 500 degre   
9298,survive,Lincoln City Oregon,10 way surviv escap martial law   world  
5135,fatal,"Sacramento, CA",stockton polic investig fatal drive bi shoot north stockton  
7187,mudslide,Ireland, mariankey rubber mudslide  still laughing 
5739,forest%20fires,,naturaldisast california fire rage forest servic sound alarm rise wildfir costs          
5518,flattened,"Bow, NH",idea food  flatten 
6940,mass%20murderer,,anoth white mass murderer  antioch  
7301,nuclear%20reactor,"USA, North Dakota",salem 2 nuclear reactor shut electr circuit failur pump  salem 2 nuclear reactor bee    
10073,typhoon,,obama declar disast typhoon devast saipan  obama sign disast declar northern marian a    
17,,,haha south tampa get flood hah  wait second live south tampa gonna gonna fvck flood
8208,riot,"Uppsala, Sweden",serious tactic riot headquart disney marvel   
10259,war%20zone,"California, USA",gear war 1  preview member  come chat  xb1  welcom danger zone   
5705,floods,,memphi alway flood
1763,buildings%20burning,"Dublin City, Ireland", rockbottomradfm one challeng tough enough rescu peopl burn buildings 
856,bioterror,US,fedex longer transport bioterror germ wake anthrax lab mishap 
9986,tsunami,#ODU, tsunami nopeach        i m weak af
7312,nuclear%20reactor,, roberthard  repjohnkatko crazi use netanyahu argument iran flush nuclear reactor toilet
2852,cyclone,Made in America,cyclon doubl g would cherri top thi outfit  ootd doubleghat  
3578,desolate,,unexercis honda run down neighborhood desolate  psqd
2671,crush,05/04/2014 18:23 ?, pydisney que crush mtvhottest justin bieber
1916,burning,"New York, NY",you   r pay attent influenc you   r burn money   socialtim 
1271,blood,North Jersey, olrul welcom   read free chapter new book encount jesus  it  full hope  
252,ambulance,West Wales,anyon travel aberystwyth shrewsburi right there  incident  servic halt outsid shrews  ambul scene 
2927,danger,Spinning through time., riverroam  and much danger please  
6389,hurricane,, eggali haha love hurrican becaus
8494,screaming,,love wake dad scream       
1568,bomb,"Oxford, OH",flat bomb  flavafraz21 whatcanthedo
4857,evacuation,The Empire/First Order, ariabrisard  leiaorganasolo good  play along her  may begin oper death star  evacu nearli complete 
1029,bleeding,,way archetyp bleed well ground readiness  fpoj 
7323,nuclear%20reactor,Paris (France),magnet electrostat nuclear fusion reactor 
3684,destroy,, sj gist   148 hous farm produc destroy     streetjamzdotnet   
4499,emergency,New York,surviv kit whistl fire starter wire saw cree torch emerg blanket knife    full re     
5442,first%20responders,"Los Angeles, CA",there  still room parti first respond around country  3rd annual best ever  
7895,radiation%20emergency,"LP, MN USA", nuclear emerg current usa radiat level monitor site
2782,curfew,"KLA,Uganda",next may i ll free   from school oblig like family     best damn curfew   
1499,body%20bags,,women cross bodi messeng bag clutch small shoulder zipper bag white  
7957,rainstorm,ECSU16,way move like full rainstorm i m hous cards 
3822,detonate,Brasil,  no periferico apollo brown    detonate  f  m o p   orapinforma
6693,landslide,,thi govt hubri ha small maj yet act ha landslide  opposit req d vision rigour  amp  hunger serv thi democracy 
7815,quarantine,,reddit quarantin offens content 
1114,blew%20up,, imawesome7986 like liter blew
1989,bush%20fires,"Canberra, Australian Capital Territory",californian bush fire 2015 
7837,quarantine,,reddit quarantin offensive  cont  
8688,sinkhole,,random hole broke street    
8125,rescued,The green and pleasant land.,whi taken back africa onc rescued  c4new
9505,terrorist,"New Delhi, India",udhampur terror attack  nia take probe pakistani terrorist quizzed  pak deni link    elect achedin    
8591,screams,texas,scream mother 
263,ambulance,"Swindon,England ", tanslash wait ambul
1644,bombing,WorldWide,australia new   japan mark 70th anniversari hiroshima atom bomb   read more  
3468,derailed,"Anchorage, AK", epic insan got derail outsid grimrail depot   
4180,drown,"Saint Louis, Missouri",keep drown insult feel devot pride ten fold action reprocuss set birth retroactive 
8085,rescue,Karachi,flood zon   gener raheel sharif visit chitral   also laud effort  fwo armi troop armi aviat rescu opera   
10803,wrecked,,wreck me  never felt low life  it  okay god got
164,aftershock,Switzerland,320  ir  icemoon  aftershock        djicemoon   dubstep trapmus dnb edm danc ices    
8518,screaming,"Mogadishu, New Jersey", missdaoh scream babi would love much
3117,debris,In the Shadows,debri found reunion island wa flight mh370  mysteri behind plane disappear could better ani novel 
1249,blood,Bug Forest,guys  imouto actual relat blood 
8434,sandstorm,WA State,come sandstorm tryout aug 15th lower woodland  m tryout  3 4 30pm h tryout  4 30 6pm
8147,rescuers,#iminchina,video   we r pick bodi water    rescuer search hundr migrant mediterranean    
6084,heat%20wave,"Nebraska, Colorado & The GLOBE",weather warfar follow money thi govern found father warn us weather    
8806,sirens,victoria mozÌ£o ,ouvindo sleep siren awn
1017,blazing,Konoha,   srajapakse   whi thank missi    thought suit blaze hot summertim    yee haw    
1572,bomb,,bomb wa appropri    seen famili jamaican love shout bullet  
5904,harm,"Seattle, WA",standard test harm children color  via  parentsacrossam cc   billgat
435,apocalypse,,minecraft  night lucki block mod  bob apocalyps wither 2 0  amp  more   mod showcas popularmmos   via  youtub
1077,bleeding,,rave wed   see thi  eye bleed
777,avalanche,,free ebay snipe rt   chevrolet   avalanch ltz lift 4x4 truck  pleas favorit  amp  share
10307,weapon,, abcnew nuclear bomb terribl weapon  
8526,screaming,"Aveiro, Portugal",hey lone girl did tell friends about way got scream name 
5495,flames,Some where,pardon burst flames    i v enough world people  mindless game
3592,desolate,,august 5 1620 one hundred odd pilgrim england holland set sail new world  unimpressed  
1006,blazing,"Saltillo, Coahuila de Zaragoza",still blaze     
6896,mass%20murder,"Huntsville, AL",okay sure word  mass murder  appli dure thi war wa horrend none less  
799,battle,UK Great Britain ,ad video  youtub playlist  world tank   battl assist mod bat chat arti kaboom
1142,blight,"University Heights, Ohio",cleveland height shaker height fight blight  hous next door 
527,army,"Harlem, New York",stoni jackson america  last hope lead armi felon thu armi reject armi satan   
6330,hostage,"Victorville, CA",wut lone lunch  got ditched  i m hungrier hostage 
1259,blood,The World,ain t hoe blood
9474,terrorism,"toronto, ontario", adamniblo arrest report  affili terror
2801,curfew,,whi charli lim start 9pm thi sunday      curfew leh    
3210,deluged,"Bishops Lydeard, England", thewesterngaz i m sure shop delug local children want buy it  really 
5795,hail,Arkansas,strong thunderstorm 4 mile north japton move se 25 mph  larg hail wind gust 50 mph poss    arwx 
10004,tsunami,in the Word of God, greenlacey godslov  amp  thanku sister rt new video  come apocalypt us earthquak  amp  tsunami
8717,sinking,"Michigan, USA",      if lost  amp  alon sink like stone carri on    
2793,curfew,Pon Di Gully,rite man tlk widout nuh curfew long side aka cum fi steal di show itz rubberi di whole dem fi knw    sound  music 
6325,hostage,,went pick lunch today bartend wa hold chang hostag becaus want number    
1219,blizzard,Ontario Canada, tcgreno hard reset xbox
2902,damage,Tennessee, gettinglost  jennellensbb  muncle jim said superfici wound wa pepper spray damage 
3821,detonate,"Memphis,TN/ World Wide",apollo brown    detonate  f  m o p  
4985,explosion,On the toilet having a dump , lordrsbiscuit that  alway good pretti explosion 
3995,devastation,"Mount Vernon, NY",devastation  come  target find  starbuck close    momneedscoffe asap iwontmakeit
3962,devastation,contactSimpleNews@gmail.com,70 year atom bomb japan still struggl war past  anniversari devast wrought b    
5548,flattened,Derby,mum  liter pick new car today flatten batteri alreadi tri sort bluetooth      muppet
3798,detonate,"Morioh, Japan", tinyjecht anoth stand user  deton killer queen 
1326,bloody,Brazil ,i v watch episod s01e09 bloodi monday   bloodymonday tvshowtim 
7482,obliteration,,doe renov mean obliteration   entrepreneur manag leadership smallbiz startup busi
10527,wildfire,"Eddyville, Oregon 97343",oregon  biggest wildfir slow growth  via  katunew
5800,hail,Inside the Beltway (DC Area),cue storm massiv wind hail   power outag  wxii davidson county 
7021,mayhem,,magic citi mayhem  kissimme adventur   aug  5 2015 
2537,collision,"Peterborough, Ontario, Canada",two vehicl collis fowler corner hwy  7 frank hill rd  block road  opp  onli minor injuri occupants 
1625,bombed,"Ikeja, Nigeria",70 year ago today unit state america bomb hiroshima japan 
6854,mass%20murder,New Sweden,media need stop public mass murder  mani sick peopl thing eye world  amp  media helping 
9106,suicide%20bomb,dorito land,she  suicid bomb
483,armageddon,East Kilbride,european fitba till christma  armageddon
3753,destruction,Valle Del Sol, danhrothschild greed fuel self destruction  takecar
4411,electrocute,, i electrocut turn   
6466,injured,USA,offer    8392 delux toilet safeti support health home bathroom support elderly injured s    
5487,flames,manaus,watch go flame
9771,trapped,,hollywood movi trap miner releas chile  zippednew 
4256,drowning,Coventry,whi drown low self image  take quiz   
1431,body%20bagging,"Sydney, New South Wales", ohmyloz  rondarousey bag bodi   she  smoke hot   
4097,displaced,United Kingdom,displac disast label legal statu remain reach 
6087,hellfire,,prophet  peac upon him  said  save hellfir even give half date charity  
10840,,,sismo detectado jap  n 15 41 07 seismic intens 0 iwat miyagi jst    
3831,detonate,, woundedpigeon  deton  apollobrown ft  m o p 
8389,ruin,CA ??DC,peopl i d let ruin life soul cervix everything  odel definit top list 
4060,displaced,New York City, i amtalia  sgc72  thousand peopl displaced injured kil hey there  opportun differ restaurants  
3059,deaths,AsunciÌ_n-PY / TÌ_bingen-GER,breast milk origin superfood rate worldwid stall 40  contribut 800000 child death last year 
7268,nuclear%20disaster,"Dhaka, Bangladsh",want see hiroshima nagasaki nuclear bomb disast thi beauti world let peac  amp  save thi human civilization 
9259,sunk,Derby,quit sunk saw johnni marr primal scream space hour sunday
3001,dead,Milton Keynes ,can t believ ross dead          emmerdal  mikeparractor emmerdal summerf
6520,injuries,Corpus - Las Vegas - Houston,injuri starting    pleas  dallascowboy stay healthy                
5570,flood,,2pc 18w cree led work light  offroad lamp car truck boat mine 4wd flood beam   full rea     
3812,detonate,"Broomfield, CO",boulder deputi wait bomb squad deton grenad like thi one found stearn lake today 
4273,drowning,"Madison, WI", nigeltanner1 believ we v much rain here  newli plant mapl tree actual drowning 
5890,harm,Kansas City, leedsroug love picked  we r play worth fifth harm kid ink becaus you  listen  amp  vote  
2655,crush,Kaneohe, kuualohax like love husband you r post anoth man man crush monday  lol
2579,crash,"  Melbourne, Australia", destinythegam  bungi  playstat get kick crash one worst experi i v play video games 
10596,wounded,"Victoria, Canada",twilight  encor  wound heart book 3  jacqui biggar  via  amazon kindlecountdown sale mfrwauthor mgtab
8558,screams,Freddy Fazbears pizzeria, drag0nking0201  screams don t scare animatron
3879,detonation,New York,deton fashion mountain electron watch water resist coupl leisur tab     
1074,bleeding,My heart is a ghost town!,ear start bleed again   
5235,fatality,434,usual never happen
10421,whirlwind,Internet,richard return whirlwind day  mlb
1775,buildings%20on%20fire,"Manchester, NH",fire destroy two build 2nd street manchest 
9752,tragedy,NYC / International,rli tragedi mp  live recount horror     when saw coach train plung water call     
2076,casualty,,unpredict disconnect social casualti favorit peopl like
2499,collided,"ÌÏT: 41.252426,-96.072013",crew work restor power southwest omaha vehicl collid util pole    
2727,crushed,, jmastrodonato question is  would crush ortiz bunt sport write forefath crush williams 
7812,quarantine,,reddit updat content polici promis quarantin    extrem offensive    commun 
9490,terrorism,,truth     news bbc cnn islam truth god isis terrorism quran li 
5743,forest%20fires,"Washington, D.C.",california fire rage forest servic sound alarm sharpli rise wildfir cost  
5056,eyewitness,"Orlando, Fl",wftv eyewit news  fbi  man stole us secret  married  honduran minor sex 
2471,collided,Waco TX,major accid caus life threaten injuri close highway  18 wheeler suv collid then    
1699,bridge%20collapse,US,two giant crane hold bridg collaps nearbi home 
4086,displaced,Pedophile hunting ground,myanmar  displac rohingya sittw point return   prison like condit genocid ihhen msf refuge
2362,collapsed,"CAMARILLO, CA", organicallyrud  1rockstar62 wish mattingli  amp  bundi  amp  mcgwire stand collapsed 
849,bioterror,,fedex longer transport bioterror germ wake anthrax lab mishap  new phone appl mobil
7585,outbreak,"Ile-Ife,Osun state, Nigeria",new famili sue legionnaires  40 famili affect fatal outbreak legionnaires     
2543,collision,"San Francisco, CA",solano sr37   skagg island rd   trfc collision 1141 enrt   
8083,rescue,Wanderlust,mari come troy rescue         
3932,devastated,,bairstow drop hi buffet ticket there  devast lad 
1275,blood,,shed innoc blood son daughter land wa pollut psalm 106 38  help stop sin abortion 
10663,wounds,,cut celebreti post wound onlin no go 
9130,suicide%20bomb,,iraq   hashd shaabi theft isi suicid car bomb  isi 
7851,quarantined,South Africa,hot  reddit  new content polici goe effect mani horribl subreddit ban quarantin  prebreak best
10775,wreckage,Mumbai,wreckag  conclus confirmed  mh370  malaysia pm  investig famili were    
3793,destruction,,temptat alway lead destruct
8274,rioting,,rt   whi sweden venezuela  day riot venezuela riot direct gr    
10173,violent%20storm,Worldwide,violent forc radio  play agoni   storm apocalypse tunein player   
2397,collapsed,,look  i collaps after attempt munch endang species 
4108,drought,"Okanagan Valley, BC",makewaterwork okanagan  drought rate max   okanagan valley   westerncanadadrought
1632,bombing,Shipwreck Cove,it  70 year  and one hour  sinc bomb hiroshima  let  take thi time remember 
3137,debris,Nigeria ,malaysia confirm plane debri wash reunion island flight mh370 
6116,hellfire,??????????? ???????????..? ,hellfir surround desir care don   t let desir control you  afterlif islam
2221,chemical%20emergency,"Beaumont, TX",emerg crew respond chemic spill downtown beaumont benew 
8786,siren,Flipadelphia, soonermagic  mean i m fan need girl sound like damn siren
7120,military,, stfxunivers peopl die human experi unit 731 japanes militari  
10466,wild%20fires,"Hartford, Connecticut",firefight connecticut head california fight wild fire  
8869,smoke,atlanta, thetshirtkid i m tryna smoke mf
2811,cyclone,Rural Northern Nevada, mccauleysdesign  abysmaljoin  dyamiplotk work purpose  larg cyclon would better   4k  thi wa  500
10402,whirlwind,World,pawsox owner public return whirlwind trip durham   knoxvil new sentinel  
6198,hijacker,,school bu hijack given parol 39 year 
2556,crash,Tennessee,bought anoth  meinlcymb 18  medium crash   hey  meinlcymb endorsement  start get expensive 
1412,body%20bag,,handbag fashion style  authent loui vuitton pochett bosphor shoulder cross bodi bag    
3053,deaths,,vaxshil 2 death measl complic 10 yr everyon loos shit  8 dead legionnair month  amp  cricket
4272,drowning,"Hughes, AR", famili mourn drown  superhero  toddler rare epilepsi   chicago tribun 
4138,drought,Philadelphia,california meet drought fuel fire season extra crews   relat articles  
6530,injuries,,diego costa need stop get injuri urg
4712,evacuate,,chicago  ap      organ lollapalooza say reopen music festiv threat storm prompt evacu
3900,devastated,PG Chillin!,man currensi realli talkin talk    i d devast ghostwrit anybodi else    
8625,seismic,,sismo detectado jap  n  report 3  01 02 17 okinawa island region m3 8 depth 10km maximum seismic intens 3 jst   
6246,hijacking,China,hot  funtenna  hijack comput send data sound wave  black hat 2015   prebreak best
2238,chemical%20emergency,"Evanston, IL",emerg unit simul chemic explos nu  suppos student research lab northwestern    
9757,tragedy,America, csaresu   american tragedi 
6569,injury,mnl,new level tita dom  bowl injury  
1244,blood,"Seattle, WA", chambered blood yeah are  speakingfromexperi
4309,dust%20storm,,dust storm  en route  alic spring uluru 
7173,mudslide,plymouth, brobread look like mudslide    
412,apocalypse,Oakland,juli   r apocalyps version romeo   juliet warmbodi
10320,weapon,www.twitch.tv/PKSparkxx,slosher goat  freak love weapon  can t wait episod splatdown it   switch splatl gun now 
9237,suicide%20bombing,Tokyo & Osaka,9   without bomb would hara kiri know commit suicide    hiroshima 70 year ago 
4758,evacuate,Û¢901Û¢,fam evacu bc need power
8533,screaming,UK, blanksocietyx  emmerdal im scream favourit
10331,weapon,"New York, NY",03 08 11  polic stop 41 year old bronx cite  case victim location   weapon found 
5590,flood,,bmx issu areal flood advisori shelbi  al  till aug 5 9 00 pm cdt 
5134,fatal,Poconos,five fatal flaw iran deal  via  youtub
5207,fatalities,Just Happy to Be Anywhere,  kurtschlicht yep consid  millions  japanes fatal project downfall    freemarket  dibang
10025,twister,,last second outbid rt   2   catlow c720 twister swivel 3 4  3dc fuel line made usa  pleas favorit  amp  shar
8856,smoke,,2014 onli smoke crqck becym mayor  thi includ foursquare 
5212,fatality,playing soccer & eating pizza, jake adavi  fatality u cuddl right so     
9348,survived,NYC,meet man surviv hiroshima nagasaki  
1596,bombed,Old Blighty, nicklee8  went school bomb east end london3 famili one hous bathroom outsid loo  amp  poor yr point
18,,,rain flood florida tampabay tampa 18 19 days  i v lost count 
10090,typhoon,Evergreen Colorado,satellit spi super typhoon soudelor space  photo  
10317,weapon,"CT, USA", camilla 33  craykain hate shatter delus hatchet deadli weapon justifi lethal force  gunsens
5380,fire%20truck,,it  never good sign pull work  amp  there  five ambul  amp  fire truck bay  wompppp least it  friday
2321,collapse,lugo,eurocrisi guardian greece  tax revenu collaps debt crisi continues  talk continu propos        
8251,rioting,,would black dude antioch would riot
4820,evacuation,"Eureka, California, USA",humboldt cti sheriff  offic ha issu evacu advisori 10 resid lassic area    info 
6315,hostage,"ÌÏT: 40.562796,-75.488849",murfreesboro peeps  i m hear walmart rutherford lockdown hostag true rumor 
3276,demolish,Hooters on Peachtree,noth midget demolish show respect
8408,sandstorm,"Hamilton County, IN",sandstorm    woo hoo  
8221,riot,"Montana, USA",like  youtub video  sick riot shield slide spots  
5826,hail,United States,unr continu sever thunderstorm warn  wind  60 mph hail   lt  75 in  weston  wy  custer fall river pennington  sd  till 7 15 p   
8871,smoke,,trynna smoke tj hoe
144,accident,UK,  norwaymfa bahrain polic previous die road accid kill explos 
5763,forest%20fires,"Boise, Idaho",8 5 2015   4 30 p m    progress made bois forest fires  
10147,upheaval,"Milwaukee, WI",look state action year ferguson  upheav 
7983,razed,,latest  home raze northern california wildfir   abc new 
3877,detonation,,miss chri appy  deton myth obscur crime hiroshima 70 yr ago thi month   salon 
10049,twister,,doe open scene harri potter order phoenix remind anyon els movi twister  me  okay
5164,fatalities,New York,nyc new legionnair death toll rise 8 new york city  eight fatal older adult with    
5349,fire,"Vancouver, BC", justin l promis tax pancak rainbow die fire 
804,battle,"San Jose, CA",kelbi tomlinson mild mann 2nd baseman great metropolitan team fight never end battl hit rbi sfgiant way 
3715,destroyed,everydaynigerian@gmail.com,everydaynaija   flood  two peopl dead 60 hous destroy kaduna 
96,accident,CLVLND, i can t kid cuz got bicycl accid  amp  split testicles  it  imposs kids  michael father
