id,keyword,location,cleaned_text
4610,emergency%20services,"British Columbia, Canada",veteran vet act would ensur everi militari veteran  access highest level emerg care services  proper treatmen     followm
4005,disaster,, lovelylikelaura see whi one favorit book  beauti disaster  may one mine  
6053,heat%20wave,Pacific Northwest,uae cool mideast heat wave  rain watch latest  video  ncm issu warn thunder rain poor visibility     
2666,crush,Everywhere,samel samel ha crush  
470,armageddon,Nowhere. Everywhere., rohnertparkdp you r anoth one histori books   thank justic department   way paid incom tax 20yrs 
6870,mass%20murder,, guardian ha japan ever truli come term devast mass murder million chines tradit weapons 
6506,injuries,"Rockland County, NY",west nyack pineview road railroad cross western highway  unit scene csx train vs  truck injuries 
1221,blizzard,,realli wanna browni batter blizzard   
9313,survive,United States,learn grow becom stronger face surviv trial must pass  thomassmonson ld mormon
8497,screaming,"21, Porto",i m scream fangirl oh god  
8287,rioting,,footbal hooligan jail riot befor game scotland wa alreadi ban match england uknew 
6296,hostage,Starling City,moth held hostag yesterday ha chill bathroom windowsil day i m okay thi
2821,cyclone,Philippines ,sever weather bulletin no  5 for  typhoon    hannaph     soudelor  trop cyclone  warning  issu 5 00 pm 06    
4292,drowning,Pittsburgh ,drown actavi suicid
4328,dust%20storm,"Pocatello, ID",storm head toward idaho fall blow dust  amp  wind 60 mph   us hwi 20  amp  i15 look out   idwx 
10787,wrecked,,good luck everyon ha school soon sleep schedul wreck beyond repair
6911,mass%20murderer,wisco,it  like god want becom mass murder mani dickhead deal daili basis 
7168,mudslide,London,gbbo differ paul mari dears paul   it look like mudslide  mary   i feel it  go tast great 
4736,evacuate,Sevier County.,store  fire alarm went today work evacuate  wa like  omg   i s i s  happening     
8026,refugees,,refuge connect indiegogo campaign go live tomorrow  support us help launch onli onlin commun refugees 
9060,structural%20failure,San Francisco, clip  top down coercion   structur weak ensur govern failur 
7738,panicking,, jeannathoma gonna lie   i m panick littl bit  vic hardi there   freeman practicing 
9897,traumatised,,i m slightli traumatis thi week  one born 
1759,buildings%20burning,"Savannah, GA",sink ship burn build  amp  fall object remind old us 
2262,cliff%20fall,norway,regress slip fall cliff
6452,injured,, chikislizeth08 you r injur anymore    
5229,fatality,"Enterprise, NV",fatal  
3052,death,"Alicante, Spain",new  nyc legionnaires  diseas death toll rise  follow  
4313,dust%20storm,,   so     watch trail dust storm think part died     colin perfect goodness 
10451,wild%20fires,"Toronto, Bob-Lo, Miami Beach",catastroph wild fire threaten u s  mid west  amp  republican fight new climat chang rule guess thi ultim darwin
8691,sinkhole,,share larg sinkhol swallow entir pond lownd counti georgia large     yonew
8926,snowstorm,, pyrbliss ah rememb days  snowstorm too 
10251,war%20zone,Incognito,zone ender mgs2 god war  rt  d pagexxi  quot thi favorit ps2 game
5124,fatal,Quincy,man accus fatal hit and run get new judg  via  khqa
7579,outbreak,,famili sue legionnaires  40 famili affect fatal outbreak legionnaires  disea    
6627,inundated,Pontefract UK, ledofficial1 imagin we r inund request week sampl  amp  much we d love abl send sweet 1 2
7242,natural%20disaster,Leitchfield Kentucky,natur disast get angry  
3183,deluge,,whole slew updat post come host fixed  unfml delug
4595,emergency%20plan,Calgary,storm conclud citi calgary  municip emerg plan deactiv 
2759,curfew,"State College, PA",night curfew campus   find here   
3373,demolition,,gener new       demolit hous waterway begin achimota mile 7   via  233liveonline  full stori 
10121,upheaval,"Scotts Valley, CA",depth  new world work young peopl busi economi cope huge upheav  via  ft
8839,sirens,,sleep siren vai vir pra sp
2956,dead,,miss longer hair  but wa dead anyway even hair
1842,burned,"Oakland, CA",burn dog find new home young burn victim 
3463,derailed,, jozerphin liter look up  yeah derail smithsonian everythign shut feder center sw mcpherson
2647,crashed,,f496d mhtw4fnet  pakistan say armi helicopt ha crash country  restiv northwest    fox new
10482,wild%20fires,Canada, wbcshirl2 ye god doessnt chang  say rejoic fall peopl calam like wild fire  ect  wanna punished 
6072,heat%20wave,"Oklahoma City, OK",longest streak triple digit heat sinc 2013 forecast dallas  unrel danger heat wave will    
8949,storm,"Chicago, IL",prepar properti storm    
8973,storm,#BossNation!,finna storm  fuck back boutta start hurt like mf       
9949,trouble,USA, astro stunningli poor defens it  pitcher  bat mia like top 1st inning thi team trouble 
10730,wreck,, titortau loretta lynch one wa fuckin  hi lari watch realtime  wa like train wreck fact check ombudsmanship 
7987,razed,,latest  home raze northern california wildfir   abc new 
3383,demolition,,think get demo car friend join demolit derbi kenosha
5685,floods,"Timaru District, New Zealand", contactenergi yep  dure flood 1999 2000   clyde dam releas everi bit water could  speccy   ev charg way 
7318,nuclear%20reactor,"New York, New York",japan  restart nuclear reactor fleet fast approach 
241,airplane%20accident,Fashion Heaven. IG: TMId_,phone look like wa car ship airplan accident  terribl
6658,landslide,"Dundee, UK",armi veteran fear loos rock dunde landslid could kill ani moment  ha face hail bullets    
9591,thunder,,brother cri caus thunder lmao
9982,tsunami,Land Of The Kings, tsunami esh    hey esh
1882,burning,"Hampton Roads, VA",8 minut fat burn routin that    also realli fun  fat weightless  fatburn burnfat skinni workout
7638,pandemonium,,   pandemonium aba woman deliv babi without face  
10473,wild%20fires,"London, UK", randerson62 watch news wild fire hope ok 
7254,nuclear%20disaster,"New York, NY",physic sens help preserv memori 2011 tripl disast  8 4 ajw   jishin  nuclear minamisoma
3171,deluge,London,whi mani half nak men twitter tonight   normal i d embrac odd torso scale tonight  delug unpreced
4744,evacuate,,summer program work went citi pool evacu becaus one kid left surprise   jimmyfallon worstsummerjob
622,arsonist,,town salem melt ice cube bc im arsonist  d
471,armageddon,"Florida, USA",vladimir putin issu major warn late escap armageddon  
9868,traumatised,Scotland, pyramidhead76 one good thing came watch film   wa traumatis watch show start halt  amp  catch fire amazon   d
10149,upheaval,,great upheav winik jay  
10273,war%20zone,Southern California, kasiakosek drive suck case becaus know desk look like war zone everyon goe  i need this  mode
23,,,what  man 
3253,demolish,Washington D.C.,rand paul  debat strategi  demolish bad idea point mayb em    
3173,deluge,"Nottingham, England",best window torrent client  wa recommend delug look like wa written 10 year ago java swing  uses  wors
10436,wild%20fires,Houston,wild fire blacken northern california parch harri counti becom tinder box   
4107,drought,Nigeria,w          nema warn nigerian prepar drought 
713,attacked,,christian attack muslim templ mount wave isra flag via pamela geller       
2489,collided,"Johannesburg, South Africa",2 pple confirm dead 20 rescu mani went miss ferri carri 200 collid fish boat new
9609,thunderstorm,,nigga play thunderstorm    hope lorr bless em      
10733,wreck,scumbernauld,i m emot wreck watch emmerdal
438,apocalypse,Las Vegas,know go zombi take over   
2216,chemical%20emergency,,chemic brother play armori sf tomorrow night   emerg bay area edm announc     chem    
3241,deluged,, accionempresa u s  depart commerc ha delug last two month com      gerenciatodo   
8191,rescuers,"Here, there and everywhere",video   we r pick bodi water   rescuer search hundr migrant the     bbc new
10518,wildfire,"California, USA",california battl scariest 2015 wildfir far   rocki fire 
4888,explode,"Yamaku Academy, Class 3-4",version ks charact wa  every  charact world would explode   rin shizune misha emi kenji yuuko nomiya hisao
8445,screamed,,update  polic seem like nice enough people  felt bad transform screamed    worri they r onli unconscious 
9453,terrorism,,polit democracy    hatr hate      dawabsha threaten erod isra democracy  homegrown terror ha     
8540,screaming,nap queen,like littl boy better sit ass stop scream mother stop pull hair  amp  cri like 3 year old  amp  grow tf
9206,suicide%20bombing,,suicid bomb fear die alon
3163,deluge,,delug eulog  cecilthelion whatsapp   gt  gt thi  torment soul matia xavier  
4466,electrocuted,North Carolina,i m love thi classic barn shot  may may got electrocut got stung time step in    
6093,hellfire,United Hoods of the Globe,hellfir ep   silentmind  amp    bookofdaniel  
2163,catastrophic,,catastrophic fallen angel  reveillertm  macabrelolita  wa suppos write    amino acids    nearly    
9896,traumatised,, vickybrush lol  wa traumatis child  wednesday  jimmyfallon releas topic thursday hashtag game  thi thi weeks  xoxo
3737,destroyed,, davidvitt hi david 2003 saw usa walk war destroy live millions  prevent repeat  irand
1371,blown%20up,London/Outlaw Country , orbett like blown amirit
6594,inundated,Bristol,hi  fionagilbert  sorri delay  slightli inund applic mo get back asap 
10686,wreck,, captainn morgan car wreck   
9606,thunder,,love sound thunder rumbl across mountains 
6033,hazardous,United States,dlh issu hazard weather outlook  hwo    wx
6746,lava,,wish earth sea sky above would send someon lava    
1126,blew%20up,wherever the $$$ at,bitch done blew shit
2418,collide,"Silang, Cavite / ParaÌ±aque",let collid fill space     
10361,weapons,Multinational *****, jamesmelvil old testimoni weapon use promot conflicts tact   corrupt  amp  infiltr groups 
5137,fatal,,11 year old boy charg manslaught toddler  report  11 year old boy ha charg manslaught fatal sh   
7465,obliteration,"New Orleans ,Louisiana",whi god order obliter ancient canaanites  
1022,blazing,Nigeria,blaze hot  etisalat free mb complet 12 months  etisalat give 100mb tecno q1 ime    
5068,famine,JamDung,ppl like unu feast today famin tomorrow
10424,whirlwind,Where I Need To Be, theemobrago back anoth jitsu make hexagon ground laid there   64 palm whirlwind   yell air began  
2644,crashed,i love the smurfs 2,honestli nightmarish  god drive new place alway stress shit  amp  hate much  ugh  almost crash time
10349,weapons,England,hiroshima nagasaki rememb kill alleg us war crime use nuclear weapon  uswarcrim
446,armageddon,"California, United States",pbban  temporary 300  avysss   armageddon   kill   flag onli   fast xp  reason
748,avalanche,"Loughton, Essex, UK",like  youtub video  kall mattson    avalanche   offici video 
8505,screaming,Massachusetts , estellasreveng first time went swime wa basic scream whi doe smell tast bad
2973,dead,,beforeitsnew   hundr fear dead libyan migrant boat capsiz dure rescu      
7663,panic,,wa laugh talk junk everyon panic mode
6092,hellfire,jeddah | Khartoum,bewar temper loos tongue  two danger weapon combin lead person hellfir islam 
4978,explosion,,time laps map everi nuclear explos sinc 1945   isao hashimoto war atomicbomb  
7277,nuclear%20disaster,#goingdownthetoilet Illinois,close eye disaster   state depart unawar report iran sanit nuclear site 
9333,survive,, adriennetomah peopl surviv like that  
3131,debris,,aircraft debri found island mh370 malaysia confirm 
9028,stretcher,south africa eastern cape,mxaaaa south african can t appreci effort stretcher wa bad  stop hate
10009,twister,"Calgary, Alberta",gail russel saw lot hail dalroy home   video twister 1 2 mile home yyc 
4672,engulfed,,came land wa engulf tribal war turn land peac i e  madinah  prophetmuhammad islam
6781,lightning,Elchilicitanierraversal ,nowplay  the lightn strike  de snow patrol de hundr million sun   
9730,tragedy,,modiministri rli tragedi mp  live recount horror 
3666,destroy,UK,yiayplan use awesom collect amiibo destroy path 
6760,lightning,"Memphis, in the Tennessees", random tourist rained  guy tree hit lightn jackhol drove onto flood streets 
526,army,,one direct pick  fan armi direction 
10718,wreck,"Arlington, TX",got car wreck  car front put blinker       realli doe feel great outsid lol
1453,body%20bagging,,i m drake fan enjoy see body bag people  great market lol 
3659,destroy,,ng2x5 mhtw4fnet  watch michael jordan absolut destroy thi meme bait camper   foxsportscom
4465,electrocuted,, steveycheese99  mapmyrun electrocut way round  map sure look like it 
9363,survived,, michael5so fuck live im surpris ive surviv thi long
5420,first%20responders,"Portage, IN / Worldwide",   we help    say denver firefight work curb first respond suicid 
5818,hail,,heavi rain lightn overhead oakridg sw calgari   least melt hail      yycstorm abstorm
3839,detonate,"New York, NY",press play  apollobrown  new singl m o p   detonate   
37,,,way   i can t eat shit
8676,sinkhole,"San Diego, CA",rt twit san diego  possibl sinkhol disrupt trolley service  depress portion asphalt downtown sa    
8934,snowstorm,Porthcawl,like  youtub video  boe 737 takeoff snowstorm  hd cockpit view   atc audio   episod 18
1467,body%20bagging,"Houston, TX",drake kept hip hop dure thi beef fuck bodi bag meek back back   
9089,structural%20failure,"Chicago, IL",ntsb  virgin galact crash caus structur failur trigger brake unlock earli  
3180,deluge,London,perhap  historic  appli delug recent expos childsexabus truli  historic  scale cover up
6624,inundated,"San Jose, CA, USA",thi set becom huge one month wonder   and pornhub inundated      
983,blazing,"Intramuros, Manila",come join us tomorrow  august 7 2015 transcend blaz trail diversifi world marketing    
8715,sinking,,movi  titanic  jack rose could stay wooden beam without sinking 
10217,volcano,,erupt indonesian volcano spark transport chaos  thi pictur done video mount raung in      
506,army,cyprus,build kingdom lead armi victory    start g thi friend code  lzktjnox 
1628,bombed,MA, misfitrar misfit got bomb
6828,loud%20bang,im definitely taller than you.,wa peac sit room heard thi loud bang someth fall
1098,blew%20up,Waterford MI,rick morti   blew   
38,,,wa nyc last week 
8183,rescuers,,video   we r pick bodi water   rescuer search hundr migrant mediterranean boat carryi   
9107,suicide%20bomb,Nigeria,bestnaijamade  16yr old pkk suicid bomber deton bomb      bestnaijamad bestnaijamad bestnaijamad be   
2680,crush,"Washington, DC NATIVE",mrrobinson give thesteveharveyshow vibe  music teacher look student ha crush girl went high school with    
2788,curfew,California,lie though  it  pay oldest sometimes  like first get car curfew  freedom donthat
6546,injury,,enter world extrem dive     9 stori volga river 
672,attack,"Scotland, United Kingdom", left hand side diamond graveyard shift attack defend  th right handsid fuck idiot 
6892,mass%20murder,"Nashville, TN", billy hodg aurora theater shoot trial  gunman expect notorieti mass murder noth els  
2069,casualty,"El Dorado, KS", thomashcrown grandfath wa set first group marin hit japan oper olympic  95  casualti rate predict
8791,siren,high way 99,u know music good hear siren get chill
8271,rioting,, ryleedowns02  nevaehburton33 get money tomorrow riot   
9509,terrorist,"Sanganer, Rajasthan", rahulkanw whi  jammu soft target terrorist
1038,bleeding,"Vero Beach , FL", jaydennotjar can t help it  hope you r ok  text need talk  send hug way  ps bleed death allow
5893,harm,The barn,i v burn befor self harm way i m dumbass allow around fire way
9210,suicide%20bombing,USA,turkish troop kill kurdish milit  suicid attack  
5849,hailstorm,"Suginami-ku, Tokyo, Japan",sever weather rare hailstorm pummel boston   
3648,destroy,New York City,putin  plan destroy western food en mass caus huge public backlash 
9941,trouble,,worst  voic ever hear  nikki trouble  voic mom
4877,explode,Australia,it  cold head want explode   joy work home   i m go back bed   peac     
8372,ruin,"2,360 miles away",hate im awkward ruin thing
98,accident,"Santa Clara, CA",accid center lane block santaclara us 101 nb befor great america pkwi bayarea traffic 
3725,destroyed,"ÌÏT: 6.4682,3.18287",flood  two peopl dead 60 hous destroy kaduna  two peopl reportedli kill an     semasirtalk
10059,typhoon,Savage States of America,map  typhoon soudelor  predict path approach taiwan  expect make landfal southern china s    
5791,hail,,hail shadow  hybrid mix feat  mike szuter     youtub youtub
7358,obliterate,The Memesphere,accord propheci also cnn mac tablet complet obliter need gadgets  combining    
3629,desolation,"Kalimantan Timur, Indonesia", caus right read good send letter no  unless you r gonna mail desol row  
5652,flooding,Jakarta/Kuala Lumpur/S'pore,myanmar  msf assist thousand worst flood decad hit part myanmar 
688,attack,"Dayton, Ohio",dayton area org tell wa hit cyber attack  
9931,trouble,,oh god ryan troubl 
10592,wounded,New York,one man fatal shot anoth wound vermont street buffalo   
4026,disaster,,top insur blast lack australian govt action disast mitig  via  smh
6617,inundated,, bcfcticketladi  mr aamir javaid see inund atm want say well done   grand job kro
3876,detonation,Bangkok Thailand,new favorite  trivium   deton  rrusa  soundcloud
5613,flooding,"Tampa-St. Petersburg, FL",busi spong dock wash rain flooding  
10113,upheaval,,look state action year ferguson    upheav  
10747,wreckage,,scienc piec wreckag flight mh370 ha confirm r  union island possibl t     
4656,engulfed,,came land wa engulf tribal war turn land peac i e  madinah  prophetmuhammad islam
6699,lava,"Pocatello, Idaho",perfect night soak  lava come   
5282,fear,Midwestern USA, cowgirllawy must refus becom nation everyon live fear shot unawar intox  amp  or crazi people 
1662,bombing,North East USA,wa like surviv atom bomb hiroshima 
9088,structural%20failure,,investig rule catastroph structur failur result 2014 virg   relat articles  
6108,hellfire,"11th dimension, los angeles",hellfir song hunchback notr dame remind lot hous
4032,disaster,Dappar (Mohali) Punjab, gurmeetramrahim msgdoing111welfarework green welfar forc ke appx 65000 member har time disast victim ki help ke liy tyar hai    
3260,demolish,State of Dreaming,us four demolish this    createdunique23  keren serpa  arianareed11  
5315,fire,SÌ£o Paulo,marquei como visto game throne   3x5   kiss fire  bancodeseri
482,armageddon,"Helsinki, Finland", samihonkonen time  23 hour     latest seri ww1 blueprint armageddon extrem impressive 
6100,hellfire,Colorado, ian hellfir said it  rude base experience  kind next level sub tweet way lol  either way got work
10136,upheaval,"East Aurora, NY",tiger wonder much upheav team affect differ player tonight 
64,ablaze,,want set chicago ablaz preaching    hotel  
6688,landslide,,landslid trip skardu 
6769,lightning,"Rotterdam, The Netherlands", benji devo thank thank  3
5521,flattened,Mars,flatten 
8637,seismic,UK,england east coast  dogger bank westward  1  seismic survey progress m v western regent tow 8400 metr long cabl within area   
10008,twister,,it  alil twister tha end to  wa like oh nah   
8163,rescuers,,video   we r pick bodi water   rescuer search hundr migrant mediterranean boat carryi   
3533,derailment,India,train derailment   it  freakiest freak accidents    indian express  new  topstori
6878,mass%20murder,,made good point  white person come mass murder label crimin minor doe thing    
413,apocalypse,,apocalyps upon us
2309,collapse,"Kolkata, India",warn pont shock australian collaps   yahoo cricket india 
10410,whirlwind,,whirlwind medusa audio snake  16 microphon input 0 return 150 ft  
5489,flames,,chose search joy two us we   ll near smile matter cold flame burn bod portgassdk
5956,hazard,"Roppongi, Minato, Tokyo ", thatpersianguy  youngsaf    eden hazard harden spot flop ident
9553,threat,"Arlington, VA",get access extens sourc threat inform right box  easili add intern intelligence  bhusa
6908,mass%20murderer,Earth-616, creel you must think i m real moron flag man  brainless mass muscle   do   but think you r mass murderer 
8686,sinkhole,Newcastle,sinkhol leak sewag open hous estate irish independent 3 aug 2015
9405,survivors,"Dallas, TX ",haunt memori drawn survivor 
4869,explode,"Williamsburg, VA",hous start explod new  height  
8759,siren,Team Slytherin,super sweet beauti    
8553,screams,"San Juan, Puerto Rico", himeruisu i m go ram ass hard i ll shove face pillow muffl scream pain pleasure 
1954,burning%20buildings,"Victoria, British Columbia",heavi smoke pour build fire port coquitlam  
5243,fatality,, jax mk2   stage fatality uud lk  close 
3395,demolition,"Washington, DC",china detain seven christian tri protect church  cross demolit  
1744,buildings%20burning,"Chicago, IL", joshcorman  infosec rather knew firefight  day  often  run burn build deal it 
2211,chemical%20emergency,"Virginia, United States",illinois  emerg unit simul chemic explos nu  via  sharethi hazmat
10067,typhoon,ngapain?,obama declar disast typhoon devast saipan  obama sign disast declar northern marian a    
4738,evacuate,Rochester,evacu student throw dungeon  stupid 
2594,crash,,see dat liabl fuck crash     
751,avalanche,guaravitas,we ll crash like avalanch
6603,inundated,Land of Lincoln, yahoocar perhap chang name yahoo care   inund complaint cannot respond me  
9347,survived,Auburn , taaylordarr thank you    surviv     
5730,forest%20fire,Los Angeles for now,forest fire socal onli fire watch  ybtheprophet realhiphop 
340,annihilated,Swaning Around,annihil damascus  syrian armi grind    alloosh hi gang manur pile 
10444,wild%20fires,"Los Angeles, CA",map show california  wildfir burning  thi map creat cal fire     
10743,wreckage,WorldWide,australia new   rt janeenorman   high probability  aircraft wreckag mh370 accord deputi prime     
10637,wounds,"Sale, England", charlesdagnal he  get 50 think  salt  wounds  rub  in 
1648,bombing,,japan mark 70th anniversari hiroshima atom bomb 
4671,engulfed,,men escap car engulf flame parley  canyon crew investig caus    
1523,body%20bags,ANYWEHERE !!,status  last seen buy bodi bags 
8841,sirens,,it   run sirens   half hour hotel   halfhourhotel  edgarsgift   premium promotion  offer 
6277,hijacking,Malaysia,murder stori america    first hijack 
7184,mudslide,"Memphis, TN",oso washington mudslid respons interview     part 1 
2953,dead,,joel 2 28  book act 2 17  
8698,sinking,Every Where in the World,horribl sink feel you   v home phone realis 3g thi whole time
3182,deluge,USA,audio  16 busi owner share would differ pt1 
4342,dust%20storm,chicago,go fest  bring swim goggl dust storm circl pit
4062,displaced,,philippin must protect intern displac person warn un expert 
7826,quarantine,Geneva. And beyond. ,wired  reddit quarantin offens content   reddit co found ceo steve huffman ha unveil sp    
9148,suicide%20bomber,,isi claim respons saudi suicid bomb  
5552,flattened,"Mississauga, Ontario", tweetinglew  tersestuff   notley flatten harper hi heartland harp import ten thousand tfw slave cost albertan job
3284,demolish,London,imagin kp root     we d demolish everyon
130,accident,"Manchester, NH",accid left lane block manchest rt 293 nb befor eddi rd stop go traffic back nh 3a delay 4 min traffic
7775,police,"Milwaukee, WI",new technolog design help prevent danger polic chases  effort reduc injuri milwauke police    
7348,obliterate,"Cavite, Philippines", people   republ   china     proc     abandon west philippin sea      via  changepilipina
6267,hijacking,china,hot  funtenna  hijack comput send data sound wave  black hat 2015   prebreak best
7319,nuclear%20reactor,"Phoenix, Arizona, USA",i m also mistaken we r sit right next 2 nuclear reactor  smart cataclysm event  amp  reator melt down 
8418,sandstorm,USA,watch thi airport get swallow sandstorm minut 
2329,collapse,"San Jose, California",timestack  photo collaps entir sunset singl mesmer images  
5075,famine,, food crematoria  provok outrag amid crisi famin memories    
9406,survivors,"SÌ£o Paulo, Brasil",hiroshima survivor fight nuclear industri brazil     video 
2975,dead,South Stand, jones94kyl oh fuck sake dead     
4553,emergency%20plan,"Calgary, AB",thi citi calgari     citi calgari ha activ municip emerg plan  th municip emergency    
10606,wounded,USA,one man fatal shot anoth wound vermont street buffalo   
1702,bridge%20collapse,UK,australia  ash disast   collaps unfold trent bridg   telegraph 
9906,traumatised,, argentaelit haha traumatis      hell want job    xxx
2078,casualty,"Trinity, Bailiwick of Jersey", scriptettesar  katiecool447 btw 30th actual next year casualti began 6th septemb 1986 2016 mark 30 year
1519,body%20bags,, your bodi heal bag eye go away you   ll happi you   ll smile really     
2294,cliff%20fall,"New York, NY ",one day want someon run ferri fall crack face open almost knock get boat       
3642,desolation,"Richmond, VA",winter desol death also tumblr     al necro  review interview  amp  more 
10269,war%20zone,Still. ??S.A.N.D.O.S??,mama i m still thuggin world war zone homi inmat em dead wrong 
7018,mayhem,"Boston, MA", alexbelloli well know lol
2780,curfew,, scotrail seen turn blind eye bloke drink smoke dure curfew time cos it worth hassle 
7969,razed,,latest  home raze northern california wildfir   abc new 
1240,blood,,dialys grandpa oh lord thi blood make light head
10870,,, aria ahrari  thetawniest control wild fire california even northern part state  veri troubling 
10846,,,heat wave warn aa  ayyo dei  plan visit friend year 
3368,demolition,,civilian popul ever deserv demolit may never forget  amp  learn mistak hiroshima
2308,collapse,Swan River, geoffrickli see option buy full collaps vinyl tee bundl waiting 
4216,drowned,Colorado Springs, jacksonvil famili band togeth memori plan toddler       florida    
6243,hijacking,"perth, australia ",hot  funtenna  hijack comput send data sound wave  black hat 2015   prebreak best
