id,keyword,location,cleaned_text
2714,crushed,"Chicago, IL",  jimmyfallon crush squirrel bone mortar pestl school  bio dept  realli sure whi worstsummerjob
7361,obliterate,Cymru araul, mccainenl think spectacular look stonewal riot obliter white house 
1290,bloody,Chicago,can t bloodi wait   soni set date stephen king       the dark tower    stephenk thedarktow    bdisgust
1932,burning%20buildings,,protest ralli stone mountain  atleast they r burn build loot store like individu  protest 
4041,disaster,"Calgary, AB", rbcinsur quot websit   disaster  tri 3 browser  amp  3 machines  alway get  miss info  error due non exist drop down 
2332,collapse,Fakefams,correction  tent collaps stori 
9616,thunderstorm,Jupiter,usnwsgov sever weather statement issu august 05 10 38pm edt nws     the sever thunderstorm warn     
2689,crush,Utah,crush content marketing  mediocr  
4349,earthquake,Earth,1 43 earthquak occur near mount st  helen area washington 09 36 utc  earthquak 
7416,obliterated,,destroy zimmerman fan club twitter  rzimmermanjr obliter renewsit reduc sock acc  
4646,emergency%20services,"Los Angeles, CA",missionhil ca nurs   regist nurs   emerg depart   full time    provid health  amp  servic 
1058,bleeding,"Island Lake, IL", jannet2208 fell someone  back hit head concret    wa bleed n shit
1543,bomb,Canada, cranboonitz go make ani bomb threats   hereticofeth
10809,wrecked,,twin pitcher  ego wreck
8711,sinking,,walk plank sink ship
5208,fatalities,,ship logist enca   fatal migrant boat capsiz med hundr onboard       capsiz i     
2057,casualties,,afghanistan  sharp rise women children casualti first half 2015 
6027,hazardous,"Portland, OR",hazard   hazard condit sb i5 fwi   sw terwillig blvd portland  portland polic pp15000266858  17 26 pdx911
5717,forest%20fire,"Redding, California, USA",ashenforest floorburnt manzanita  amp  timber johnson fire along ridg forest road 1  routecomplex 
1614,bombed,Erbil,  vagersedolla visit villag recent bomb turkey find peopl fed pkk 
8126,rescued,Earth,migrant rescu boat capsiz libya 
4680,engulfed,,feel engulf low self image  take quiz   
9039,stretcher,, daretotaha nah think get stretcher foreskin u think 
3372,demolition,??????, demolit company  der abbruchsimul
971,blaze,Mo.City,mixtap come promise  goin right 
7903,radiation%20emergency,"La Grange Park, IL",doe  wipp facil nm investig site filter radiat reading  ha activ emerg op center  say offsit release 
8423,sandstorm,USA,watch thi airport get swallow sandstorm minut 
9654,thunderstorm,"Lethbridge, AB, Canada",wed 20 30  mainli cloudy  60 percent chanc shower thi even risk thunderstorm  low 10 
5626,flooding,UK,flood ukflood   british trekker rescu amid flash flood himalayas  group british tr       flood
4227,drowned,Halfrica,pick ground swam befor drowned  hit bottom hard bounc twice suffic thi time around different 
6145,hijack,,0 day bug fulli patch os x come activ exploit bypass password       ar technica 
10126,upheaval,,tt kettlebel upheav blueprint chri lopez hindsight  jhmnye
2771,curfew,, aptly engineerd curfew 
6128,hellfire,"Denver, Colorado", mechamacgyv wow bet got blame huh 
4064,displaced,,kca votejkt48id 12news  update  famili 3 ha displac fire damag hous near 90th osborn  fire extinguish i   
10368,weapons,"Vermont, USA",think thi plan retirement  check weapon mass instruction  bookmobil librari read 
3702,destroyed,todaysbigstock.com,media stock get destroy  di foxa cmcsa sni amcx viab via twx  
10278,war%20zone,, robertoneill31 get hit foul ball sit hardli freak accident  it  war zone 
5861,hailstorm,,summer heat drive bobcat calgari backyard   3  
297,annihilated,"Horsemind, MI",shall annihil petebest dessic laid bare  shall kneel befor me 
3227,deluged,Manchester,whi delug low self image  take quiz   
3554,desolate,,thank lot roadwork men co tube strike disrupt enough walk desol rout tottenham      
10770,wreckage,iTunes,scienc piec wreckag flight mh370 ha confirm r  union island possibl t     
6912,mass%20murderer,, atljw  cnnbrk fine line btw mass murder terrorist  ye know there  polit  social aspect yet  howev went
9460,terrorism,,diretub inform     egypt cypru greec agre fight  terror  
2068,casualty,,anoth sad ocean casualty gray whale popul pacif list critic endang  drone video    
10709,wreck,,emot train wreck  bodi train wreck  i m wreck
6965,massacre,"Nottingham, England",besti make watch texa chainsaw massacr         
10054,twister,Downtown Oklahoma City, thebuffshow  thetwisterokc boyfriend want see  shaniatwain too  twisterlovesshania        
191,aftershock,,aftershock back school kick wa great  want thank everyon make possible  great night 
6380,hostages,EastCarolina,hot  c 130 special modifi land stadium rescu hostag iran 1980  prebreak best
1831,burned,"Erie, PA", wild lionx3 get burn
5842,hailstorm,,hail th user summon hailstorm last five turns  damag pokemon except ice type 
8557,screams,,appar face scream   get emot attach cheat me 
4047,disaster,Morocco, youssefyamani add fez weather equat best recip disaster 
5226,fatality,,wow fatal 101 big rig hit motorcyclist blood everywher    wow  i m sick 
732,attacked,,attack robot lvl 19 i v earn total 6615434 free satoshis   robotcoingam bitcoin freebitcoin
432,apocalypse,Buffalo NY,there  storm cairo latest  x men apocalypse  set photo  via  yahootv
10842,,,breaking  isi claim respons mosqu attack saudi arabia kill 13  
6903,mass%20murderer,,kach wa group belong baruch goldstein mass murder 1994 shot kill 29 palestinian    
10016,twister,Detroit,crazi mom threw teen daughter nude twister sex parti accord friend59 pic  
3938,devastated,probably petting an animal,devast today  allegations 
5559,flattened,Rocketing through the galaxy, satanaofhel ever seen far  dreami look came hi face hi ear flatten start walk slowli toward her   you d 
3398,demolition,,7 christian detain zhejiang amid widespread anger cross removal  1200 cross remov sinc last yr 
992,blazing,, baseballquotes1 32 inch dynasti
6971,massacre,"Vancouver, BC, Canada", bloodbath tv favourit youtub channel go right now  lov everyth guy thank introduc dude bro parti massacr
4765,evacuated,"Chicago, IL",green line servic south side disrupt cta train derail passeng evacuated   
7525,oil%20spill,"England, Great Britain.",nation brief   west  california  spring oil spill estim grows  document releas wednesday d      nyt 
4257,drowning,94123,2 hi explan wa  you request much want provid get job done you r constantli drown work  
384,annihilation,"Tacoma,Washington",u  nation park servic tonto nation forest  stop annihil salt river wild horse     via  chang
6197,hijacker,Washington state,governor allow parol school bu hijack  via  nbcnew rememb thi crime sent chill parent
8621,seismic,,thank benson  amp  clegg follow  check map 
8843,smoke,, lifeaintfairkid i d smoke brooo 
3393,demolition,everywhere,dont think paint lab build caus plan  demolit     sinc forever 
7590,outbreak,,outbreak legionnaires  diseas new york ha kill least 8 peopl     offici think they v fo    
7583,outbreak,Finland,famili sue legionnaires  40 famili affect fatal outbreak legionnaires  disea    
10305,weapon,Central Florida,breaking  obama offici gave muslim terrorist weapon use texa attack 
7907,radiation%20emergency,,els want document radiat emerg procedur 06 24 09 radiat emerg procedur 06 24 09 
5310,fear,USA,daili reflections august 6 driven driven hundr form fear self delus self seek self pity    
1760,buildings%20burning,dallas,like music video want real action shit like burn build polic chase weak ben winston shit
7759,police,Nigeria,trend nigeria  polic charg tradit ruler informant     murder 
1110,blew%20up,california mermaid ? ,guy whistl park lot  amp  help wind blew skirt get car   
4959,exploded,,work fast food joint  pour burnt hot oil sink  hit water trap exploded    fallontonight worstsummerjob
2429,collide,EspÌ_rito Santo,mayb star align mayb world collid
6397,hurricane,Vineyard, chubbysquirrel   hurricane surg thi veri true  gt  33333
9663,tornado,"Gurgaon, Haryana. ",tornadogiveaway    thebookclub    join in    
10087,typhoon,"Wilmington, Delaware",map  typhoon soudelor  predict path approach taiwan  expect make landfal southern china by    
3139,debris,,plane debri discov reunion island belong flight mh370     malaysian pm 
5689,floods,Philippines,pagasa 7 12am  yellow warn   panay island guimara negros  possibl flood low li area  amp  landslid mountain areas 
6900,mass%20murderer,"Haysville, KS", carlachamorro hillari mass murderer 
8138,rescued,Canada,angri mistrust rescu eleph find peac friendship new home  photos   via  onegreenplanet
3837,detonate,Worldwide,apollo brown   deton  ft  m o p    fiya 
3773,destruction,,crackdown 3 destruct restrict multiplayer  crackdown 3 impress earlier thi week demonstratio    
8496,screaming,,quiet enough liter hear phandom scream tyler tweet
320,annihilated,,70 year sinc annihil 100000 peopl instantli becam awar abil annihil whole human
646,attack,"Dallas, TX",stay vigilent  civil liberti constant attack  nativehuman myreligion  
3710,destroyed,,emot destroy
2587,crash,,  one night we r gonna come crash party weren t invit we r feelin  so    
3819,detonate,Colorado, bldrcosheriff say 2nd grenad found  younger  wwii era grenad found earlier  they ll deton 8 00 tonight   cbsdenver
946,blaze,"Raleigh Durham, NC",break firefight battl blaze east cari condo build 
9828,trauma,,butt trauma extraordinair
9384,survived,Scotland, pixeljanosz  angelheartnight rememb now   wa british man surviv also   can t rememb hi name though 
1556,bomb,Ireland,crew enolagay nuclear bomb board disarmed  15 min hiroshima got readi arm littl boy 
923,bioterrorism,,irand onli cover nuclear activity  bioterrorism  iran ha broken least 27 agreements 
7131,military,"Virginia, USA", teamhendrick  teamhendrick  ririnsid finger cross driver hendrick militari hospit w   neanea2724 
7941,rainstorm,"Memphis, TN",rainstorm last nearli long enough
10125,upheaval,IG/SC:bjfordiani,but     oh    how rich soil    how wonder upheaval      entershikari
10479,wild%20fires,, enzasbargain a5 donat fruit snack  amp  handi wipe fire fighter battl wild fires  profittothepeopl
8020,refugees,,          whao   12000 nigerian refuge repatri cameroon 
4511,emergency,Phoenix,god forbid anyon famili know answer phone  need new emerg contacts 
1130,blight,Kama | 18 | France , damidnight actual theori magist arent onli reason blight that dwarv  the one
5172,fatalities,"Chamblee, Georgia",6 month mark total 662 fatal   114 first half last year    
8130,rescued,"Leeds, U.K.",trust us get rescu dopey ones   emmerdal  summerf
2443,collide,"Medford, NJ",thedoolinggroup 2 injur 2 school buse collid      breaking  school bu slam school bu bordento    
7320,nuclear%20reactor,, willie am i  justthebottl would cri nuclear reactor cool tank   winechat
4493,electrocuted,,i m shower went go chang song cours get fuck electrocut cord
7973,razed,,latest  home raze northern california wildfir   abc new 
260,ambulance,Mumbai,get run ambul lucky  justsay randomthought
1307,bloody,Glasgow,i m aw painting   whi agre a3 landscap bloodi oil paint   
2934,danger,"Newcastle Upon Tyne, England", thetxi  gunnersfan89 whi would arsen fan want that  west ham releg battl thi season  danger afc sun
10159,violent%20storm,UK,terrifi pov footag captur violent land insid passeng jet dure storm amsterdam  travel
9770,trapped,,hollywood movi trap miner releas chile 
6841,loud%20bang,Fairgrounds Resident,move  bang bang rock roll   art brut    it  long sinc i v play thi one loud  art brut top pops 
10191,violent%20storm,,dramat video show plane land dure violent storm    
637,arsonist,ss, casper rmg  bestcomedyvin crack cuz
1776,buildings%20on%20fire,"Tulsa, Oklahoma",multipl build fire downtown hinton  
8016,refugees,paradise,retweet cameroon repatri 12000 nigerian refuge due boko haram 
5819,hail,"Calgary, AB", heyitsepark heavi rain hail
10045,twister,,twister danc game  danc consol instruct cabl 5 pre load song  
8253,rioting,Vidalia GA, reuter peopl like charg inevit riot contribut lie
6549,injury,"Cambridge, Massachusetts",greg garza 18 atla tonight vs leon negro copa mx play  left previou game w  injury  usmnt
4779,evacuated,"TV5, Philippines",5 dead 3 miss 103 famili evacu due flood bukidnon      
6396,hurricane,Berlin - Germany, lavapixcom see hurrican guillermo meteoearth  
8965,storm,Mackem in Bolton,everi time buy bag life think i v got 3 day left live 
9878,traumatised,lowestoft, vienna butch funni im traumatis
1860,burned,Chicago Area,joke wood ha burn work mani inning often  cubstalk
2046,casualties,Insula Barataria,   the road power pave hypocrisi casualties     francisunderwood hoc 
4529,emergency,,eye nation  amp  broader conserv commun alaska  akgovbillwalk reinstat emerg buffer protectdenaliwolv
2195,catastrophic,"Dublin, Ireland", kessler syndrome  name catastroph exponenti prolifer space debri destruct satellites  gravitymovi
26,,,car fast
517,army,New York,infantri men lume dial armi analog quartz wrist watch sport blue nylon fabric    full rea     
6318,hostage,,sent email whi trinna hold hostag  rap   
8511,screaming,Justin and Ariana follow,fav i m scream fuck loud 
7231,natural%20disaster,,top insur blast lack australian govt action disast mitig  via  smh
7290,nuclear%20disaster,,u care life land sea  amp  air dont pretend  amp  ignor nuclear disast japan fukushima thi global problem
6634,inundated,, legna989 you r correct come sides  mayb i m friend fb w rep feed inund w fals claims   
1673,bridge%20collapse,,australia  ash disast   collaps unfold trent bridge      cricket
9142,suicide%20bomber,,suicid bomber kill 15 saudi secur site mosqu  mercado
6376,hostages,,one year sinjar massacr yazidi blast lack action hostages 
3357,demolition,"Lisbon, Portugal",draw day demolit daili footbal select servic consist make money lay yo     
129,accident,Maldives,rt naayf  first accid years  turn onto chandane magu near mma  taxi ram wa halfway turned  everyon conf   
10754,wreckage,Punjab,wreckag  conclus confirmed  mh370  malaysia pm
6003,hazardous,United States,jkl issu hazard weather outlook  hwo    wx
6301,hostage,Indiana,tomislav salopek islam state  recent hostage    
1887,burning,Earthling (For now!),leader zionism stop burn babi  
9787,trapped,"Georgia, USA",trap thi cat room it  go insan it  leav it  pretty  
6567,injury,,follownflnews  michael floyd  hand injuri devalu hi fantasi stock  nfl new playoff
10455,wild%20fires,"North Carolina, USA", jennife29916207 wa think today wa read wild fire
5647,flooding,, crabbycal oh god memori flood back
5302,fear,"Tulalip, Washington", mcnabbych fear
10239,volcano,"cleveland, oh", alextuck volcano bowl drink
4252,drowning,USA,grace  thi first   storm  know bicycl fenc tree fli well idiot drown go swollen rivers   
2373,collapsed,(he/him), indiepopmom cant breath lung collaps
674,attack,,volleybal attack ii volleybal train machin   set simul    
2460,collided,"-6.152261,106.775995",love hate collid part ii lanjut dirumah     yagitudeh   jake  at rumah cipinang      
8103,rescued,Canada,10 month old babi girl wa rescu coastguard float half mile sea  socialnew 
1407,body%20bag,New York,loui vuitton monogram sophi limit edit clutch cross bodi bag   full read ebay  
1066,bleeding,, sodamntru  know u you r bleed heart wannab pickup artist
2898,damage,Your Conversation,thi real shit damag bitch
2139,catastrophe,Worldwide,  aiginsur ceo  divestitur catastroph loss temper q2 result 
10106,typhoon,Dhaka,obama declar disast typhoon devast saipan  obama sign disast declar northern marian a    
5306,fear,"Hilton Head, SC  ", sensand gd ideas  i m 77 wrked hard almost noth fear live poor fran reed 8437150124
1406,body%20bag,"California, USA",    new ladi shoulder tote handbag faux leather hobo purs cross bodi bag women   rt en   
7430,obliterated,Canada, silverhuski shtap   befor town obliter earth salt t t
6974,massacre,Ecuador,mess daddi massacre  becarefulharri
3585,desolate,,egg desol
8122,rescued,NIGERIA, rescu med migrant arriv sicily  hundr migrant rescued    
4538,emergency,,busti blond teen natalia starr fuck secur guard set  view download video
7383,obliterate,cedar rapids ia,world warship make mad sometim it  soooo satisfi cross battleship obliter
10848,,,heard realli loud bang everyon asleep great
7261,nuclear%20disaster,Inexpressible Island ,3 former execut prosecut fukushima nuclear disast 
9915,trouble,Atlanta,man woman romanc  amp  south afrikaan troubl    sale preorder thebargain   
5202,fatalities,"Avon, OH",   american casualti includ 400000   800000 fatal five ten million japanes fatalities   
5719,forest%20fire,, sweet2young  run set forest fire bite shit neck 
1573,bomb,,hatchet wield gunman pepper spray fake bomb     
7043,mayhem,"Detroit, Michigan",like  youtub video  itsjustinstuart  gun rang mayhem 
10557,windstorm,Florida USA,one thing wanna see befor die gt  trump stand good windstorm hat on    hardbal
1036,bleeding,,nose bleeding  last one wa like 10 year ago
2557,crash,,html5 beginn crash cours  cours 
2432,collide,"Ormond By The Sea, FL", tackettdc like scene world collid       
8885,smoke,"Narnia, Maryland",smoke eat sleep
5898,harm,Kansas City, dinallyhot love picked  we r play worth fifth harm kid ink becaus you  listen  amp  vote  
1600,bombed,??, the third gener atom bomb survivor  photo exhibit 11 00 18 00 8 6      hiroshima 
3833,detonate,back in japan ??????????,deton  feat  m   o   p     from grandeur apollo brown 
8256,rioting,Serva Fidem,leed fan     riot embra lower tier  leagu cup final     dee dum
7929,rainstorm,music.,major rainstorm happening  i m gonna lie drift away storm around littl while  bebacksoon 
2398,collapsed,"From NY. In Scranton, PA",appar part build collapsed  hope everyon ok 
4330,dust%20storm,,learn econom one south dakota dust storm year college    hubert humphrey
1513,body%20bags,Bushkill pa,irand member congress want thi deal ani kid would b come home bodi bags  war make money
2340,collapse,#Bummerville otw,whi come work today   liter wanna collaps exhaust
4632,emergency%20services,"Sydney, New South Wales",goulburn man henri van bilsen missing  emerg servic search goulburn man disappear his    
10179,violent%20storm,Worldwide,violent forc radio  play acid storm   scourgu gods tunein player   
205,airplane%20accident,Hyderabad Telangana INDIA,horribl accid  man die wing airplan  29 07 2015  
1128,blew%20up,"Purgatory, USA", weloverobdyrdek  adrian peel damn clue  tri see mani click could get befor blew up  that  played 
6575,injury,"Nairobi , Kenya",enter world extrem dive     9 stori volga river 
7944,rainstorm,"Sicamous, British Columbia",lizzie363  cstsmith drove thru deep water flash flood  rainstorm repair cost  14000  25 yr later peopl still thnk car float   
4442,electrocute,"Cairo, Egypt.",sea would  electrocut us all 
9765,trapped,10 Steps Ahead.  Cloud 9,bomb head  explos decis dat produc dead children dead bodi trap tween build day septemb
577,arson,"Los Angeles, CA",owner chicago area gay bar admit arson scheme  via  theadvocatemag lgbt
4757,evacuate,FSC '19,want everyon know emile wa worri wa get milkshak suppos evacu
6009,hazardous,"Muntinlupa City, Philippines", hearitfrompatti also pl help us w  campaign warn public hazard keratin treatments  brazilian blowout copycat
4239,drowned,"Richmond Heights, OH",nigga favorit question whi singl    bitch know pussi wet almost drown nigga           
7446,obliteration,London UK,kontrol media say  u good  putin bad  ww3 good peac bad   total bs  leav russia alone  dice obliteration  demon
2113,catastrophe,?? ??,  uriminzok come catastroph destruct puppet republ half naemolgo continu firmli support  yiraneuni
795,avalanche,"Danville, VA",snowflak avalanch ever feel responsible 
9776,trapped,T E X A S | wwat 8.24.14,feel like episod victori got trap rv almost die heat stroke mtvhottest one direct
3058,deaths,,thi whi bsf jawan die fidayeen ha ak bloodi insas  insa rifl blame soldiers  death mod 
6059,heat%20wave,"Frisco, TX", wfaaweath pete heat wave pass  realli go mid month  frisco boy scout cano trip okla 
7617,pandemonium,"Durham, NC",element freedom mirag saturday  21  ladi free befor midnight   
10833,wrecked,Lincoln, enginesh great atmospher british lion gig tonight  hear wrecked  
5982,hazard,ilford,fair enough two best attack winger prem hazard willian basic start everi game 100 
6821,loud%20bang,"Wandsworth, London", sw train strang loud impact bang nois train epsom arriv wimbledon
1456,body%20bagging,,wwe 2k15 mycar ep18 tyron bodi bag dudes   via  youtub
1004,blazing,,i m crazi enough run 95 degre mid day heat blaze sun place i m not    
2625,crashed,"Victoria, Tx.",intact mh370 part lifts odds plane glided not crashed into sea  via  yahoofinancehop answers 
10102,typhoon,,pleas recov typhoon      
10517,wildfire,,  resid return destroy home washington wildfir burn 
6602,inundated,"Sunnyvale, CA", bentossel  producthunt thanks  know get inundated  good one 
7659,panic,Narnia,ad video  youtub playlist  panic  disco  girls girls boy  offici video 
8388,ruin,,onli make happy  fuck tryna ruin keep smile   
735,attacked,"Anna Maria, FL", christinalavv  lindsay wynn3 saw tweet feel realli attack
10825,wrecked,Global,cramer  3 word wreck di stock   
3824,detonate,Worldwide,52 214904 5 139055 nuke please  target hilversum pleas deton 800 meter surface 
8414,sandstorm,,need friend there  booz darud   sandstorm  d
9278,sunk,NYC, lt  lt  hi lip sunk bed hi arm cross behind hi head watch hi captain number hi body   resoluteshield
7012,mayhem,"North Dartmouth, Massachusetts", mayhem 114 read right left
5181,fatalities,"Washington, DC",saudi arabia  abha  fatal report follow suicid bomb mosque  avoid area 
5684,floods,"New York, NY",download   itun   flood glory  luiz santo jazz art music
2539,collision,Colorado,colorado new motorcyclist bicyclist injur denver collis broadway  least two peopl tak    
6661,landslide,New York City,inbounds  bounds   whil mani pick nat win nl east landslid current sit 2    
178,aftershock,United States, gt  gt   15 aftershock   protect profit next global financial    book   esquireattir
6772,lightning,"Greensboro, North Carolina",heavi rain gusti wind vivid lightn move east triad now  
10338,weapons,"Odawara, Japan",thing rule break onc becom easier next time    
6127,hellfire,"Charleston, WV",hellfir gargoyl hoof coil 
8952,storm,,kesabaran membuahkan hasil indah pada saat tepat  life wait storm pass it  learn danc rain 
2220,chemical%20emergency,"Seattle, Washington",new job open downtown emerg servic center seattl   chemic depend counselor intern job 
2542,collision,60th St (SS),head head collis ima problem nobodi solv em long divis
10678,wounds,"Tampa, FL", nicolaclements4 i   m sure cover head wound scab solut   
3842,detonate,"Orlando, FL",hiphop new indi apollo brown        detonate    ft  m o p     lt a href   
636,arsonist,,like  youtub video  slimebeast  town salem   win arsonist
4856,evacuation,,thi evil generation rock roll evacuation  a far eye see   hey hey hey hey  
5575,flood,Aix-en-Provence/Utrecht, creationmin  rwrabbit  gooneratheist  atheistic 1  lolatjesu yet still whi mani fish die worldwid flood  wonder 
8213,riot,,riot kit bah   part new concept gear come autumn winter menswear fashion urbanfashion    
3336,demolished,"Dublin, Ireland",home2 suit offic come salvi  bistro site  former salvi  bistro soon demolish make    
9684,tornado,Providence RI / Lisnaskea ,still can t get thunderstorm tornado woken yesterday  half street still dark  
798,battle,,dragon ball z  battl god  2014    rotten tomato  via  rottentomato
576,arson,,jewish leader pray hospit palestinian famili treat arson  via  huffpostrelig
7720,panicking,"Melbourne, Victoria",panick becaus mayb bff left china bar mayb tinder toilet 20min
1328,bloody,"Santa Cruz, CA",black friday turn bloodi  would rather shopping    mysteri
5372,fire%20truck,District 12 - Orange County,sigalert updat 3   n 133 close 5 fwi ufn     trash truck fire
10302,weapon,"UK,singer,songwriter,?2 act", weapon x mus hey guy thank rock world follow        
3452,derail,"Dorset, United Kingdom",sound judgement mpc   prematur rise could derail recoveri busi 
6200,hijacker,Halifax,remov  linkuri browser hijack  
496,army,,beyonc pick  fan armi beyhiv  77
6863,mass%20murder,"Leicester, England", d1ff3r3nt1sg00d  riceechrispi commit mass murder 
8642,sinkhole,Unknown ,sinkhol selfies  wont believ what  brooklyn sinkhole            sinkhol selfies  wont belie    
9093,suicide%20bomb,, foxnewsinsid obama give fals time schedul iran test first bomb      bomb   nuclear suicid vest
4025,disaster,Naperville,illinoi tornado slip radar emerg offici say 
8775,siren,"Massachusetts, USA", envyseven beauti aquariu queenmi siren cliff pretens overtures pleas sing thi phantom songfor alon shall
1124,blew%20up,"Ottawa, Canada",zayn blew twitter 
1963,burning%20buildings,Spying on your thoughts, kshllcenterpri1  progress4ohio burn build mean like burnt black churches 
4844,evacuation,"Renfrew, Scotland", batfanuk enjoy show today  great fun  emerg non evacu wa interesting  great run 
9391,survived,,    bbcwomanshour  setsuko thurlow surviv hiroshima bomb  thi story   
9785,trapped,,trap disappear
6921,mass%20murderer,"Eww, I'm not Paul Elam",reminder  mass murder white supremacist ander breivik wa also unsurprisingli anti feminist  
2995,dead,Spare 'Oom,that  val dead im su
10707,wreck,"Alabama, USA",first wreck today  glad mom okay  could v lot worse  happi lord wa us today       
2095,casualty,"Hospital, bc of SKH vid.",social casualti mtvhottest 5so
3231,deluged,,tarp protect outfield cannot moved  infield get deluged 
1020,blazing,"Saint Marys, GA",blaze elwood  blazingelwood   bother  doug  song   tune 
7568,outbreak,"Stockholm, Sweden", senatemajldr let  tri best prevent anoth outbreak violenc talk peopl polit
