id,keyword,location,cleaned_text
4713,evacuate,Tallahassee Florida,learn evacu home event wildfir view video  ca nv ut co or 
8254,rioting,"Vista, CA",  cindi noonan cindynoonan heartbreak baltimor riot yahistor undergroundrailraod
5473,flames,,sbnation flame make good penalti killer   
774,avalanche,"Jersey City, New Jersey",musician kall mattson recreat 34 classic album cover clever music video    avalanche    
8538,screaming,9/1/13,scream 22 differ languag 
10772,wreckage,Mumbai,wreckag  conclus confirmed  mh370  malaysia pm  investig famili were    
4853,evacuation,"Portland, Ore. ",new evacu order 25 home danger hwy  8 fire near roosevelt wash   koin6new 
6358,hostages,"Tampa, Fl",c 130 special modifi land stadium rescu hostag iran 1980     submitt     aviationaddict
1504,body%20bags,#937??#734, baskgod bodi bag
10496,wildfire,Australia,nowplay gt  amp  wildfir feat  freak love feel like  origin mix  massiv danc radio listenlive  
10588,wounded,North Cack/919,also love  buri heart wound knee  too  thegam
7657,panic,"Charleston, IL", if plan doe work panic bc 25 letters   like thi feel like may run letters  thoughts 
6679,landslide,,method contempl incid lead bridal landslide  wiwnpfxa 
7114,military,,ford   militari veri nice m151a1 mutt match m416 trailer   full read ebay  
9667,tornado,Austin,73rd good water ski nation championship go plan next week    event w  damag tornado mon 
3860,detonation,,ignit knock  detonation  sensor senso fit 01 06 bmw 325ci 2 5l l6  
5966,hazard,Dil's Campsite, dead dreamer15    becaus fire that d safeti hazard
9145,suicide%20bomber,,isi claim respons saudi mosqu suicid bomb  
4152,drown,"Waialua, Hawaii",littl gecko chillin  garden  end help suspect might drown     
6465,injured,someplace living my life,paulista injur wilsher
7294,nuclear%20disaster,,chernobyl disast   wikipedia free encyclopedia love nuclear technolog it  gloriou  
10081,typhoon,New York ,obama declar disast typhoon devast saipan  obama sign disast declar northern marian a    
7736,panicking,,ay fulli panick lol
4391,earthquake,#keepthefaith J&J,earthquak drill   
3950,devastation,St Joseph de Beauce,thi fragil global economi consid devast altern would caus     it  best reason    
10393,whirlwind,,sit cafe enjoy bite cram meet dure whirlwind 14 hour nyc  
895,bioterrorism,"Hudson Valley, NY",volunt need particip emerg prepared drill simul bioterror disaster    hvnewsnetwork
932,blaze,,life amazin time crazi nigga dey wanna blaze hate becaus made took wa dedic n motiv
5507,flames,"Cincinnati, OH",ad video  youtub playlist  nicki minaj   flame  offici video 
4674,engulfed,Newcastle,whi engulf low self image  take quiz   
6580,injury,Russia,big babi climb thi thing wheels  io hawk  hi knee injury      where  belt mr srk cook ur beauti ass punishment 
8361,ruin,, savannahross 4 see tryna ruin life
3669,destroy,"The Citadel, Oldtown, Westeros", petchari can t say either us displeased  u  move five spot jamaica 21  congrat reggaeboyz
2725,crushed,,crush gym crush butterfing flurri clearli prioriti straight   
2442,collide,"Yadkinville, NC",thi setlist  collideworship  thi past sunday wa powerful  song wa favorite  
277,ambulance,L. A., twelv fear kill pakistani air ambul helicopt crash 
9774,trapped,Utah,hollywood movi trap miner releas chile
1300,bloody,"Lynnfield, MA",call weekends  call bloodi mari times  thi summer  full them  new    
10745,wreckage,khanna,wreckag  conclus confirmed  mh370  malaysia pm  investig famili were    
9203,suicide%20bombing,, lt  25 dead kuwait mosqu suicid bomb claim isi offshoot 
606,arsonist,Bleak House,arson suspect link 30 fire caught northern california 
8238,riot,Mumbai,stuart broad take eight befor joe root run riot aussi
7480,obliteration,,dead space   obliter immin  2 2    via  youtub
10396,whirlwind,,life wild when     you r caught whirlwind   
2833,cyclone,"Rome, Italy",comdev asia  radio station bangladesh broadcast program  to address upcom cyclon komen 
4580,emergency%20plan,U.S. Northern Virginia,biztip recommend busi get altern sourc electricity  solar wind batteries  emerg plan  now 
1201,blizzard,Ontario Canada,mic control work one second
8058,refugees,"Geneva, Switzerland",chpsre  rt  refugees  follow pari visit  a dream humanity  exhibit rezaphotographi         
8335,rubble,"Portland, OR",new post   china  stock market crash  gem rubble   
1725,buildings%20burning,NJ, themagickidrap upset ralli upset burn build busi execut cop noth etc
8887,smoke,"Winnipeg, MB, Canada",mental twitt note  make sure smoke alarm batteri snuff time face mani twitter remind chang battery 
1623,bombed,,even notic background i m floatin head bomb 
6159,hijack,Nigeria,patienc jonathan move hijack apc bayelsa  st 
2976,dead,dundalk ireland, emmerdal ross realli dead   askcharley
9634,thunderstorm,73101,sever weather statement issu august 05 9 33pm cdt nws     the sever thunderstorm warn     skywarn okwx
330,annihilated,,domain sophist annihil close up to the minut feat  zrnf
801,battle,Jerusalem!,indeed   fulli awar battle  support fight    
8562,screams,#Gladiator Û¢860Û¢757Û¢,casual phone jasmin cri scream spider
4325,dust%20storm,A sofa,new mad max screenshot show love dust storm combat magnum opu  cogxbox xboxon xbox
2552,collision,btwn a rock and a hard place,sometim space celesti bodi separ trajectori intertwin find themselv danc rather collis course 
4789,evacuated,"Benton City, Washington",thought local residents  time heavi rain    
6391,hurricane,"Haiku, Maui, Hawaii",hurrican guillermo live noaa track   loop wed aug 5th        
9577,thunder,,one thing like thunder    heheh
3003,death,,onli call text 2 nigga bff  amp  boyfriend      love boy death  nigga hold attent like   
4948,exploded,WonderlandÛÓ ?????? ???? ??????,head explod swear
4989,explosion,,cum explosion    begforcum   allday cumshot   cumcov   sexycumshot   cumtown  bj nutt  cumslut 2  girlslovecum 
10116,upheaval,Chester,save upset stress upheav let us help keep elderli peopl independent  companionship care chester  chestertweetsuk
4353,earthquake,,2 0 earthquak sicili itali iphon user download earthquak app inform 
7542,oil%20spill,United Kingdom,la times  refugio oil spill may costlier bigger project 
10406,whirlwind,New York,back seattl tacoma portland  whirlwind  
10431,whirlwind,Phila.,girl got girlfriend chevi blue like whirlwind 
2838,cyclone,, i m cyclon passion overblown  
4608,emergency%20services,,we r hiring  click apply  rn ii emerg services ft 7p 7a    nurs houston tx 
8089,rescue,India,offici rescu 367 migrant libya  25 bodi found   fox new  new
10213,volcano,,maailiss  diaporama   sixpenceee  karymski lake crater lake locat karymski volcano  in  russia  a    
4251,drowning,,drown girl caitlin r  kiernan centiped press sign number limit   full re     
3922,devastated,Bournemouth,devast isnt word ross peopl emmerdal summerf
3338,demolished,, david5fernandez  theblaz trump get absolut demolish gener election 
112,accident,"San Mateo County, CA",traffic accid n cabrillo hwy magellan av mir  08 06 15 11 03 58 
4375,earthquake,, there wa small earthquak la worri emili rossum fine  difficultpeopl great
5362,fire%20truck,"Niagara Falls, Ontario",fire call  brant av   drummond rd fire    structur   single  units  car 6 call truck 
10627,wounded,"England, United Kingdom", latestnews  polic offic wound suspect dead exchang shots  richmond va   ap      richmond pol    
8131,rescued,Ireland,three beach whale rescu kerri   
3483,derailed,"Kalamazoo, Michigan",three episod left end nigh
5220,fatality,,hibern pbx irrespect pitch fatal career pan  crbzfz
1917,burning,[ kate + they/them + infp-t ], minsuwoong complet understand becaus woke like 15 minut ago im burn
3100,deaths,Top Secret,2010 17 beluga death report seaworld averag age 15 1 2 year opseaworld 
7571,outbreak,Eagle River Alaska,new york citi outbreak  legionnaire  disease    
2129,catastrophe,, reviews  pixelsmovi catastroph funni movie    review   
1924,burning%20buildings,"St Charles, MD",i m mental prepar bomb ass school year it  i m burn build   
6470,injured,Bronx NY, christiec733 pleas support thi pleas cosponsor s  928 support aid sick injur 9 11 responders  renew911health
4468,electrocuted,,got electrocut last night work first time life     shit wa weird     
105,accident,Australia,bigrigradio live accid awar
8864,smoke,, 55436  1950 lionel train smoke locomot magne tract instruct  
6074,heat%20wave,"Maricopa, AZ", startid it  hotter phoenix thi week 3x humidity   gt   gt   heat wave 
1832,burned,,you r take shower someon flush toilet  1 second gtfo get burned                                                  
2732,crushed,"Bucks County, Pa",crush 6 mile run tonight  awesom
1106,blew%20up,Florida, iphooey  time iron michel bachmann brought thi  11 w ron paul  amp  everyon blew call hoax  wa final right
1341,blown%20up,The 5th Dimension. ,white famili  supposedli repres america  great valu   get blown horribl cgi nuclear strike      lmfaoooo            
7191,mudslide,,bae soak mudslid backroom     thisiswhywecanthaveniceth 
6523,injuries,Spring Tx,health fact  75  muscl mass made fluid  drink water prevent strain sprain injuries  
7763,police,h+l,good polic take care thi also extra secur  harrybecar
10093,typhoon,SWMO,global precipit measur satellit captur 3 d imag typhoon soudelor    nasahurrican 
7797,quarantine,missouri USA,reddit quarantine     onlinecommun reddit amageddon freespeech busi 
8758,siren,Am International,r u get married  foxy  siren  oh final jennif aniston got married          i m happi        
6514,injuries,"Madison, WI & St. Louis MO", buffoonmik knew mo much would bite us wa influenc shitti staff injuri acquisit
5256,fatality,"Brentwood, NY",ad video  youtub playlist  s x 109   sw   fatal  captain falcon  vs  snow  fox  ssb4 loser
1305,bloody,Las Vegas,ronda rousey would  close  make floyd mayweather  money 50 fight   bloodi elbow  box
7227,natural%20disaster,, book flight burma countri endur polit unrest natur disaster  wonder wa cheap ay
2957,dead,, cjban 4sake argsuppos pre born ha attain individl rights gener courtof law forbid kill unless dead person someth
8369,ruin,New York - Connecticut,damn wale know ruin song  
2430,collide,"New York, USA",check new song  collide  live boweri electric  
7491,obliteration,India,justifi whi thi quarrel would one day end obliter remain state pakistan  
10250,war%20zone,"nashville, tn ",sit still cityofmemphi traffic like sit war zone  move police   care
1208,blizzard,,lizard wizard blizzard lwb 
10072,typhoon,,typhoon soudelor  hit taiwan     bad be  generalnew 
2702,crush,,kenni holland crush da vida
3675,destroy,,get 50 eur free bet bwin use sport market destroy free  
7317,nuclear%20reactor,"Denver, CO",nuclear solar power japanes fukushima reactor energi japan temperatur no  fuel pool   
8480,screamed,pissing off antis,scream  what chonce  
9001,stretcher,Florida,restor vinyl side make look new  
7037,mayhem,"London, UK", akcsl bit both  go ventur onc i v chosen suitabl music mayhem   
4428,electrocute,, lightseraph piss could pikachu electrocut     
8946,storm,,thi storm came where   fuck cool
9040,stretcher,, stretcher  witter  rexyy  towel show pictur
4719,evacuate,,cannon ball ocean japan would evacuate 
2466,collided,,monsoon flood   monsoon rain hit india pakistan myanmar hard thi season  two train collid     
10070,typhoon,phuket thailand, foxnew let report u peopl instead mr obama declar cnmi feder disast area post typhoon soudelor  u guy 2slow2report 
513,army,Studio,build armi 100 dog leader lion dog fight like lion 
996,blazing,,shouout  kasad1lla caus vocal blaze hot like weather
9268,sunk,NAIROBI  KENYA ,arrestpastornganga worri 2 see polic offic kenya sunk low point collabor pick pocket
2051,casualties,"Absecon, NJ",civilian casualti afghanistan hit highest number sinc 2009 u n  say via  washingtonpost   
7924,rainstorm,Federal Capital Territory,rainstorm destroy 600 hous yobe   ireport  via  sharethi
10057,twister,"Seattle native in Prescott, AZ", jrlallo narrat say  chemic interest lavatory  db5  quit tongu twister certainli odd   p
4752,evacuate,,quick shut show take stage evacu everyon mthe premis loui upset
2246,chemical%20emergency,, chemical bab famili emerg can t make unless chanc use phone stream 
624,arsonist,ss,hotboy shit
10498,wildfire,,drone fire  offici offer  75000 reward lead pilot flew wildfir  photographi art
220,airplane%20accident,sri lanka,horribl accid man die wing airplan  29 07 2015  
2896,damage,Australia,thank  richarkkirkarch  ausinstarchitect word warn queenswharf brisban  via  financialreview
2663,crush,,bestfriend high school crush      yourboy shawn
1090,blew%20up,,think blew  hopeinheart notifications  go check she  encourag      love   
9338,survive,death star,surviv i ll see tomorrow
5259,fatality,Honduras,fatal     
8825,sirens,"Nanaimo, BC, Canada",photoset  hakogaku     i kurd  wa born battlefield  rais battlefield  gunfir sirens    
7908,radiation%20emergency,#MayGodHelpUS,ccot tcot radiat nuclear emerg track center  
8812,sirens,they/them , i know dill pickl tast one   me
36,,,looooool
7203,natural%20disaster,Greenwich Meridian,peopl realli natur disast
972,blaze,,  itzsteven  xdojjjj  whopper jr 760 huh   leo start last year ever sinc peopl blaze back  
6023,hazardous,"Mysore, Karnataka",foodscar offers2go nestleindia slip loss magginoodl ban unsaf hazard humanconsumpt
7132,military,NY,13 reason whi love women militari     lulgzimbestpict  
8727,sinking,,horribl sink feel you   v home phone realis 3g thi whole time 
5921,harm,Kansas City, 5hvzlaradio love picked  we r play worth fifth harm kid ink becaus you  listen  amp  vote  
5407,fire%20truck,, choos happy  fire truck rest          review kick push  jaymcleanauthor
2891,damage,"Rockville, Maryland",glaucoma occur fluid build pressur insid ey level may damag optic nerv eyefact
976,blaze,Gotham City,   ye 2 gun      
5238,fatality,Utica NY,08 3 15  cat fatality  utica ny  pleasant  amp  holland ave black cat white paws  averag size   grass next north side road 
9806,trapped,Florida,hollywood movi trap miner releas chile 
10446,wild%20fires,,god forbid thi true california ha enough problem sever drought  amp  wild fires   nuclear power sanonofr
4055,displaced,North Carolina, lizhphoto much shit go head i d rather talk outburst   displac aggress sux  
9800,trapped,Like us on Face ,hollywood movi trap miner releas chile   the 33  hollywood movi trap miner starring    
1590,bombed,Netherlands,us drone bomb islam state target syria take turkey  us arm drone ha bomb targe    
168,aftershock,,320  ir  icemoon  aftershock        djicemoon   dubstep trapmus dnb edm danc ices    
5981,hazard,, arianagrand  girl still lickin  public donuts     health hazard    u jail 
9680,tornado,california,i m tornado look soul take
355,annihilation,,u  nation park servic tonto nation forest  stop annihil salt river wild horse     via  chang
7121,military,,13 reason whi love women militari     lulgzimbestpict  
2886,damage,,beach damag shit
10258,war%20zone,"Downtown Churubusco, Indiana",camp war zone rove raccoon toughen citi slicker 
6160,hijack,,swansea  plot hijack transfer move southampton target virgil van dijk  
876,bioterror,"Espoo, Finland",usatoday  today  frontpage  bioterror lab face secret sanctions  rickperri make cut foxnew    
10195,violent%20storm,,storm blitz travers citi disrupt manag brief seminars  violent summer storm blitz tra    
4860,evacuation,"Moncton, New Brunswick",ga leak forc evacu east saint john  nb 
10308,weapon,,puls rifl weapon tuning  
7848,quarantined,,quarantin littl corner bc sick offic work pile need kinda day
5525,flattened,"Essex, England",would flatten littl midget    
3501,derailed,Headed To The Top, ohyayyyyay train derail thi morn
6605,inundated,Kenya,fb page bushman safari  zimbabw compani palmer use 2 kill cecil inund neg comment 
6184,hijack,"Oregon, USA", jasoncundy05 chelsea need hijack man utd deal pedro  20 mill bargain adam drive home oregon usa cmon blues   
2189,catastrophic,"Paonia, Colorado ",learn legaci catastroph erupt  via  newyork
1189,blizzard,"Waukesha, WI",realli want rolo blizzard mom said guess dq tonight
7071,meltdown,"Colorado, USA", nprfreshair realli can t believ skip befor republican meltdown   i mean  debate  
5265,fear,"sitting on the fence, New York", phnotf sometim cheeki bleed comput screen recoil fear
2606,crashed,,son sleep night     final 4am laid bed crash     
3122,debris,,mh370  debri found reunion island     sad tragedi innoc crash mh370
5870,hailstorm,"Iliff,Colorado  ",sever hailstorm progress northeast logan county    cowx 
8916,snowstorm,This Is Paradise. Relax. ,    lordbrathwaite  everyon here  ahh hate snow   me  lol u call thi snowstorm     growingupincolorado   
4038,disaster,los angeles,keep askin thi means not like got answers plu say wrong thing thi might turn disast
4624,emergency%20services,USA,break new   call tasmania  emerg servic train hors        
7135,military,, universityoflaw peopl die human experi unit 731 japanes militari  
2633,crashed,"Gujranwala, Pakistan",maj muzzamil pilot offr mi 17 crash near mansehra today  may almighti give strength famili bear loss 
4324,dust%20storm,,let gone away like dust wind      big wind like tornado blizzard thunder storm alway want
5581,flood,"Niagara Falls, Ontario", hellotybeeren cue flood peopl  ironically  call
6413,hurricane,,hurrican mixxtail kinda tast like watermelon four loko            brittsand9
5769,forest%20fires,,heartdiseas u s  forest servic say spend half budget fire 
9907,traumatised,, brookesddl traumatis lil shit nearli hop bloodi shower
915,bioterrorism,, howardu 90blks amp 8wht collud 2 take wht f  usagov auth hostage amp 2 make look blk w bioterrorism amp us lgl org idi id still hers 
4425,electrocute,,say she d love come help but th sea would     electrocut us all              
4732,evacuate,"Chevy Chase, MD",efak would design build occup onc evacu report evacu assembl site
621,arsonist,ss,make these  
8546,screams,,phone  worstoverdos scream  jaileen cake phone  everyon look             
6065,heat%20wave,Somewhere out there, rachelcain weatherit need make mind up  first snow tornado would say heat wave 
3531,derailment,India,25 kill 50 injur madhya pradesh twin train derail 
6784,lightning, 45å¡ 5'12.53N   14å¡ 7'24.93E, lightning wolf  realli activ directory   p
4329,dust%20storm,Room 234,current drive dust storm  
9795,trapped,WORLDWIDE!,nz hollywood movi trap miner releas chile  hugomatz
356,annihilation,CA physically- Boston Strong?,u  nation park servic tonto nation forest  stop annihil salt river wild horse     via  chang
86,ablaze,Inang Pamantasan,progress greetings   in month student would set pen ablaz torch publications     
4955,exploded,,date meet sex hot teen ass explod fat cock 
9808,trauma,,photo  lavenderpoetrycafe  trauma memori encod imag trauma sensori cognitive    
10555,windstorm,,realiti training  train fall elev track dure windstorm  fire em
5503,flames,Santo Domingo Alma Rosa ,soloquiero maryland mansion fire kill 6 caus damag plug christma tree report say   flames  firefighte   
8155,rescuers,Nigeria,roddypiperauto fear miss migrant med  rescuer search survivor boat carri ma     
1877,burning,Blogland,it  rain outsid i m burn favorit candl there  hot cocoa sip  nap time   awesomesauce 
6687,landslide,The Circle of Life,you r caught landslide i l you and rain  give sunshine i l
9701,tornado,khartoum sudan,tornado flew around room befor came
3367,demolition,Chicago,save citi old town  propos demolit 159 west burton   messnermatthew  newciti
5577,flood,New York,spot flood combo 53inch 300w curv cree led work light bar 4x4 offroad fog lamp   full re     
9688,tornado,,brunett beauti night stretch victorian sofa  view download video
6104,hellfire,"Denver, Colorado", also dont think sew thought leather belt would work well lol 
5535,flattened,,zouma flatten guy  
1985,bush%20fires,Melbourne Australia,public health team wa traumatis bush fires  could appreciativeinquiri turn thi around  
7054,meltdown,,one candid go frank grime level meltdown voter love trump matter what  
3134,debris,Hong Kong,mh370  reunion debri miss malaysia flight 
9435,survivors,Anywhere Safe, lawfulsurvivor t dog hole apart store sever survivor glenn moral andrea jacqui merle   
8842,smoke,,what  wrong lil smoke good convers     
10419,whirlwind,Las Vegas,whirlwind head scissor  alexhammerston  kttape ktfounder remymarcel frofrofro    
2648,crashed,International ,ttw today  news  bin laden famili plane crash  avoid microlight land far runway   
4373,earthquake,"Hawaii, USA",usg report m1 94 earthquak 5km volcano hawaii 8 6 15   1 04 01 utc  quak
8180,rescuers,worldwide,video   we r pick bodi water   rescuer search hundr migrant mediterran    
10222,volcano,"Hawaii, USA",usg eq  1 9   5km volcano hawaii  time2015 08 06 01 04 01 utc2015 08 05 15 04 01  10 00 a     earthquak
8830,sirens,"Decatur, GA", if look nigga follow sirens       
5603,flood,New York,spot flood combo 53inch 300w curv cree led work light bar 4x4 offroad fog lamp   full re     
6017,hazardous,,caution  breath may hazard health 
2084,casualty,,took way longer expect
10206,violent%20storm,Amsterdam & Worldwide,pov video captur violent land amsterdam airport schiphol dure storm   daili mail  amsterdam new
7393,obliterate,London, we prepar obliter rapidli complet everi product enterpris japanes abov ground ani city  
9854,trauma,"Chicago, Illinois",80  uchicago faculti member push univers overturn ban trauma center protest  
9717,tragedy,'Merica, sometim god use sorrow tragedi set stage gloriou redemption    david platt run for    
8431,sandstorm,USA,watch thi airport get swallow sandstorm minut 
5528,flattened,somewhere too cold for me, grabakahitman  izi garcia flatten machida   did lose fight  nop lost fight guy lost also
4080,displaced,Nigeria,angri woman openli accus nema steal relief materi meant idps  angri intern displac wom    
3018,death,,tell cousin wanna hang text say  we r come over  honestli death wish
6737,lava,"Madison, WI",babi oliver  swim class cri entir class  it  like hi parent waterboard dip lava
935,blaze,Columbus, shayoli ye love
9045,structural%20failure,"San Francisco, CA", lizbon  kidicalmassdc it  structur breakdown  mayb patienc failur part 
8161,rescuers,,video   we r pick bodi water   rescuer search hundr migrant mediterran    
10502,wildfire,,idfir parker ridg fact sheet aug 6 2015  parker ridg wildfire   inform phone  208 267 6773 email  pa    
479,armageddon,,ahamedi think messiah alreadi come 125 year ago  armageddon  dajaal  gog  amp  magog  
1083,blew%20up, Indiana,instagram blew appar wa featur jazz tonight  cool love
3661,destroy,, raidersreport  957thegam togeth destroy emperor rule galaxi father son 
5850,hailstorm,Washington State,free hailstorm maxi 
495,armageddon,Perthshire ,well done celtic finger cross aberdeen tomorrow night   armageddon eh       
3016,death,The UK,like  youtub video  jeromekem  dj hazard   death sport
8836,sirens,Philippines,rocket moon    sleep siren  a rocket moon             
2158,catastrophe,"Lima, PerÌ¼",britney spear  gt  vegas   miss much     can   t wait show tonight    pieceofm      catastroph    
6312,hostage,Global,horrif stori hostag   horrif stori hostag it  1974 british    
9636,thunderstorm,,sever thunderstorm warn includ russellvil ar clarksvil ar dardanel ar 10 15 pm cdt 
7108,military,Alaska,mike magner discuss trust betrayed   via  youtub militari veteran environ
6625,inundated,"UK, Republic of Ireland and Australia",inund employe holiday request paperwork  cloud base hr softwar  hronlinetweet help simplifi staf logistics 
3969,devastation,"Las Vegas, Nevada",seen devast 2014 corp  breach yet prepared  get coverage    
269,ambulance,, twelv fear kill pakistani air ambul helicopt crash 
7247,nuclear%20disaster,,beforeitsnew   3 former execut prosecut fukushima nuclear disast      
5267,fear,,biggest fear disappoint peopl believ
6676,landslide,Indiana,cool  garbanzobean23 news  cutest indot worker might littl bia    
409,apocalypse,The Shire,it  apocalyps lol gf m8
5824,hail,"Indianapolis, IN",central mass  fruit tree escap heavi damag wind hail 
9874,traumatised,, mprnew 600    wow    that  lot traumatis kids     
6208,hijacker,,mediev airplan hijack testa  earn distinct divers  htarvrgli
8752,siren,"UAE,Sharjah/ AbuDhabi",i m healing reviv side game rather better attack siren  gt  charact  except new girl  
6281,hijacking,,murder stori america    first hijack 
4961,explosion,New York,new explosion proof temper glass screen protector film blackberri z10   full read by     
2831,cyclone,Cornwall,bbc forc retract fals claim cyclon pam  via  wordpressdotcom
8938,snowstorm,Mpela'zwe ,lrt refer lyric hear big boi explain whi he    cool    sippin    milkshak snowstorm  lame bar effect time
8037,refugees,"Bangalore, India",turkish coupl decid feed 4000 syrian refuge part wed celebr  
4760,evacuate,,perhap crimin murder nazi pack bag  amp  evacu themselv london  amp  uk  tubestrik well done 
4924,exploded,Australia,junko wa 13 year old atom bomb explod hiroshima august 6 1945   
4717,evacuate,,california  amp 039 monster amp 039  fire 20  contain 13000 told evacu 
10795,wrecked,"Santa Cruz, CA",israel wreck home  want land   
3828,detonate,"Morioh, Japan", tinyjecht anoth stand user  deton killer queen 
56,ablaze,,barbado bridgetown jamaica     two car set ablaze  santa cruz     head st elizabeth polic superintende     
8453,screamed,sneaking glances at Thancred, mogacola  zamtriossu scream hit tweet
1929,burning%20buildings,, fewmoretweet live matter  fan burn build steal neighbor  protest 
974,blaze,SOUTHERN CALIFORNIA DESERT,3 bedroom 1 bath sale 29 palm ca     youtub video     
173,aftershock,"Oshawa, Canada",wisdomw bonu   5 minut daili habit could realli improv life  mani alreadi do  lifehack 
